,Date,ID,Name,Country,Method,Vintage,Qty,Account Holder,Beneficial Owner,Reason
0,2023-03-21,799,Bukaleba Forest Project,Uganda (UG),ARR,2016,50,,,
1,2023-03-21,799,Bukaleba Forest Project,Uganda (UG),ARR,2016,1161,,,
2,2023-03-21,647,Boden Creek Ecological Preserve Forest Carbon Project,Belize (BZ),Avoided Def.,2014,66,,,
3,2023-03-21,940,Replacement of existing luminaires with LED lightings in common areas of residential buildings,Singapore (SG),Other,2015,1000,,,
4,2023-03-21,647,Boden Creek Ecological Preserve Forest Carbon Project,Belize (BZ),Avoided Def.,2014,256,,,
5,2023-03-21,1382,"The Envira Amazonia Project - A Tropical Forest Conservation Project in Acre, Brazil",Brazil (BR),Avoided Def.,2013,178,Carbonext Tecnologia em Soluções Ambientais Ltda.,Florien Fitoativo,O ano inteiro
6,2023-03-21,2512,"AFFORESTATION OF DEGRADED GRASSLANDS IN VICHADA, COLOMBIA",Colombia (CO),ARR,2020,137,,,
7,2023-03-21,173,Vishnuprayag Hydro-electric Project (VHEP) by Jaiprakash Power Ventures Ltd.(JPVL),India (IN),Hydro,2014,437,,,
8,2023-03-21,173,Vishnuprayag Hydro-electric Project (VHEP) by Jaiprakash Power Ventures Ltd.(JPVL),India (IN),Hydro,2014,577,,,
9,2023-03-21,173,Vishnuprayag Hydro-electric Project (VHEP) by Jaiprakash Power Ventures Ltd.(JPVL),India (IN),Hydro,2014,633,,,
10,2023-03-21,1382,"The Envira Amazonia Project - A Tropical Forest Conservation Project in Acre, Brazil",Brazil (BR),Avoided Def.,2014,7,Carbonext Tecnologia em Soluções Ambientais Ltda.,180 Soluções e Serviços LTDA,Carbon Neutral by Carbonext
11,2023-03-21,371,Guangdong Lankou 26MW Hydro Power Project,China (CN),Hydro,2012,121,"GLOBAL FACTOR COMMODITY TRADING, S.A.U.",Bitron,"Credits are redeemed permanently for Bitron Industrie S.p.a., with respect to Customer: Gridspertise S.r.l., for GESIS 1.5, Bitron PN / Customer PN: 30630447 / 516238 and Contract ref. JA10102997"
12,2023-03-21,1622,REDD+ Project for Caribbean Guatemala: The Conservation Coast,Guatemala (GT),Avoided Def.,2012,178,Forest Carbon Limited,Pulsar,Logistics emissions 2022
13,2023-03-21,640,Flathead Electric Cooperative Landfill Gas to Energy Project,United States (US),LFG,2018,1609,,,
14,2023-03-21,2414,Davidson County Landfill,United States (US),LFG,2018,1609,,,
15,2023-03-21,902,KARIBA REDD+ PROJECT,Zimbabwe (ZW),ARR,2013,6,"Lightstone Consulting, LLC",Carbon Credit Cart customers,"CCC order# 1492 (Margaret McGlynn - Dublin, Ireland)"
16,2023-03-21,489,44 MW Bundled Wind Power Project in Maharashtra managed by Enercon India Limited.,India (IN),Wind,2018,30000,,,
17,2023-03-21,138,Greater New Bedford LFG Utilization Project,United States (US),LFG,2021,543,ClimeCo LLC,"Charlesbank Capital Partners, LLC","On behalf of Charlesbank Capital Partners, LLC"
18,2023-03-21,985,Cordillera Azul National Park REDD Project,Peru (PE),Avoided Def.,2017,1975,ClimeCo LLC,Imprenta Mariscal Cia Ltda.,On behalf of Imprenta Mariscal Cia Ltda.
19,2023-03-21,487,"210 MW Musi Hydro Power Plant, Bengkulu",Indonesia (ID),Hydro,2020,6553,South Pole Carbon Asset Management Ltd.,Pip and Nut,Retired on behalf of Pip and Nut to cover the 2021 carbon footprint
20,2023-03-21,1946,Renewable Wind Power Project by Hero Future Energies,India (IN),Wind,2020,91,3413,State of Matter,On behalf of State of Matter for the voluntary offset of their carbon emissions.
21,2023-03-21,292,"150 MW grid connected Wind Power based electricity generation project in Gujarat, India.",India (IN),Wind,2016,416,3413,State of Matter,On behalf of State of Matter for the voluntary offset of their carbon emissions.
22,2023-03-21,173,Vishnuprayag Hydro-electric Project (VHEP) by Jaiprakash Power Ventures Ltd.(JPVL),India (IN),Hydro,2016,3795,,,
23,2023-03-21,2082,Qianbei Afforestation Project,China (CN),ARR,2017,1283,Compensate Operations,Customers of Compensate Operations,Carbon credits retired by Compensate Operations on behalf of its customers.
24,2023-03-21,674,Rimba Raya Biodiversity Reserve Project,Indonesia (ID),Avoided Def.,2016,2426,Compensate Operations,Customers of Compensate Operations,Carbon credits retired by Compensate Operations on behalf of its customers.
25,2023-03-21,2458,Guoluo Grassland Sustainable Management Project,China (CN),ARR,2020,75000,,,
26,2023-03-21,354,Assunção Ceramic Fuel Switching Project,Brazil (BR),Other,2016,16,,,
27,2023-03-21,488,"82 MW Lau Renun Hydro Power Plant, North Sumatra",Indonesia (ID),Hydro,2013,466,2162,AVU Aktiengesellschaft für Versorgungs-Unternehmen,"Klimaneutralstellung Gas: TQ-Systems GmbH, Ruhrstr. 28, 58300 Wetter; Lieferjahr 2022"
28,2023-03-21,173,Vishnuprayag Hydro-electric Project (VHEP) by Jaiprakash Power Ventures Ltd.(JPVL),India (IN),Hydro,2007,50,Fokus-Zukunft GmbH & Co. KG,UNIGRUPPE & Handelshaus Kiennast,UNIGRUPPE & Handelshaus Kiennast.
29,2023-03-21,722,Guangdong Huizhou LNG Power Generation Project,China (CN),Other,2008,126,,,
30,2023-03-21,1792,Ghani Solar Renewable Power Project by Greenko Group,India (IN),Solar,2017,11,,,
31,2023-03-21,1792,Ghani Solar Renewable Power Project by Greenko Group,India (IN),Solar,2017,3000,,,
32,2023-03-21,799,Bukaleba Forest Project,Uganda (UG),ARR,2016,1106,AzzeroCO2,Fastweb S.p.A.,CO2 emissions offset for company activities (Scope 1) and operations (Scope 3) for the year 2022 - Fastweb S.p.A.
33,2023-03-21,981,Pacajai REDD+ Project,Brazil (BR),Avoided Def.,2014,8867,AzzeroCO2,Fastweb S.p.A.,CO2 emissions offset for company activities (Scope 1) and operations (Scope 3) for the year 2022 - Fastweb S.p.A.
34,2023-03-21,981,Pacajai REDD+ Project,Brazil (BR),Avoided Def.,2012,48,AzzeroCO2,Fastweb S.p.A.,CO2 emissions offset for company activities (Scope 1) and operations (Scope 3) for the year 2022 - Fastweb S.p.A.
35,2023-03-21,1665,HPP Project Liberia,Liberia (LR),Other,2018,4454,CO2logic SA,2022 Retirements - Certificate 22/196,2022 Retirements - Certificate 22/196
36,2023-03-21,2606,Fujian Qingliu IFM (conversion of logged to protected forest) Project,China (CN),IFM,2017,179,"Shanghai Treasure carbon New Energy Environmental Protection Technology Co., Ltd","China Quality Certification Centre No.INV-2023-ZLSW-0012,GHG Emission Removal,Beijing Dacheng Law Offices,LLP.(Shanghai),from 2022.1.1-2022.12.31",2022.1.1 - 2022.12.31 GHG Emission Removal
37,2023-03-21,1294,"Electric Power Generation from Renewable Sources - Barra da Paciência, Ninho da Águia, Corrente Grande, Paiol, São Gonçalo and Várzea Alegre Small Hydropower Plants",Brazil (BR),Hydro,2013,7376,AzzeroCO2,Fastweb S.p.A.,CO2 emissions offset for company activities (Scope 1) and operations (Scope 3) for the year 2022 - Fastweb S.p.A.
38,2023-03-21,831,Amayo Phase II Wind Power Project,Nicaragua (NI),Wind,2011,28292,AzzeroCO2,Fastweb S.p.A.,CO2 emissions offset for company activities (Scope 1) and operations (Scope 3) for the year 2022 - Fastweb S.p.A.
39,2023-03-21,669,Wind Energy project by Ramco group in india,India (IN),Wind,2012,14252,AzzeroCO2,Fastweb S.p.A.,CO2 emissions offset for company activities (Scope 1) and operations (Scope 3) for the year 2022 - Fastweb S.p.A.
40,2023-03-21,2293,NIHT Topaiyo REDD +,Papua New Guinea (PG),Avoided Def.,2019,122,Pangolin Associates Pty Ltd,Pangolin,Retired on behalf of FB Rice for FY2022
41,2023-03-21,2293,NIHT Topaiyo REDD +,Papua New Guinea (PG),Avoided Def.,2019,241,Pangolin Associates Pty Ltd,Pangolin,Retired on behalf of FB Rice for FY2022
42,2023-03-21,1650,Reduced Emissions from Deforestation and Degradation in Keo Seima Wildlife Sanctuary,Cambodia (KH),Avoided Def.,2015,363,Pangolin Associates Pty Ltd,Pangolin,Retired on behalf of FB Rice for FY2022
44,2023-03-21,1650,Reduced Emissions from Deforestation and Degradation in Keo Seima Wildlife Sanctuary,Cambodia (KH),Avoided Def.,2015,1,Pangolin Associates Pty Ltd,Pangolin,Retired on behalf of FB Rice for FY2022
45,2023-03-21,1044,Ziqiang 18MW Hydropower Project in Guizhou Province China,China (CN),Hydro,2011,1,TJTCX,"Lianhe Taize (Shanxi) Environmental Science and Technology Development Co.,Ltd",Achieving Zero Carbon Conference Neutralize the carbon emissions generated by the inaugural meeting of the Carbon Branch of the Shanxi Environmental Science Society
46,2023-03-21,1382,"The Envira Amazonia Project - A Tropical Forest Conservation Project in Acre, Brazil",Brazil (BR),Avoided Def.,2014,13,Carbonext Tecnologia em Soluções Ambientais Ltda.,VR Entreposto de Decoração e Comércio Ltda,Carbon Neutral by Carbonext
47,2023-03-21,814,Hebei Yuxian Second Phase 49.5MW Wind Power Project,China (CN),Wind,2016,287,Carbon Neutral Pty Ltd,m|devices,Surrendered on behalf of m|devices to offset their measured FY21/22 organisational footprint.
48,2023-03-21,1964,Quang Minh Solar Power Project,Viet Nam (VN),Solar,2021,1,Swiss Carbon Value Ltd,Hanson Australia Pty Limited,"These units were retired on behalf of Hanson Australia Pty Limited (the Buyer’s parent company) to support its product carbon neutral claim against the Climate Active Carbon Neutral Standard CY2023 and future emission periods. The units are allocated to the Powerhouse Museum Project, Sydney."
49,2023-03-21,1964,Quang Minh Solar Power Project,Viet Nam (VN),Solar,2020,3792,Swiss Carbon Value Ltd,Hanson Australia Pty Limited,"These units were retired on behalf of Hanson Australia Pty Limited (the Buyer’s parent company) to support its product carbon neutral claim against the Climate Active Carbon Neutral Standard CY2023 and future emission periods. The units are allocated to the Powerhouse Museum Project, Sydney."
50,2023-03-21,1975,Hong Phong 4 Solar 48 MW Project,Viet Nam (VN),Solar,2021,4120,Swiss Carbon Value Ltd,Hanson Australia Pty Limited,"These units were retired on behalf of Hanson Australia Pty Limited (the Buyer’s parent company) to support its product carbon neutral claim against the Climate Active Carbon Neutral Standard CY2023 and future emission periods. The units are allocated to the Powerhouse Museum Project, Sydney."
52,2023-03-21,1975,Hong Phong 4 Solar 48 MW Project,Viet Nam (VN),Solar,2020,24,Swiss Carbon Value Ltd,Hanson Australia Pty Limited,"These units were retired on behalf of Hanson Australia Pty Limited (the Buyer’s parent company) to support its product carbon neutral claim against the Climate Active Carbon Neutral Standard CY2023 and future emission periods. The units are allocated to the Powerhouse Museum Project, Sydney."
53,2023-03-21,1975,Hong Phong 4 Solar 48 MW Project,Viet Nam (VN),Solar,2019,63,Swiss Carbon Value Ltd,Hanson Australia Pty Limited,"These units were retired on behalf of Hanson Australia Pty Limited (the Buyer’s parent company) to support its product carbon neutral claim against the Climate Active Carbon Neutral Standard CY2023 and future emission periods. The units are allocated to the Powerhouse Museum Project, Sydney."
56,2023-03-21,1197,Chakala Wind Power Project in Maharashtra,India (IN),Wind,2017,248,Carbon Neutral Pty Ltd,SPS Facilities,Retired on behalf of SPS Facilities to offset its self-measured CY2022 footprint.
57,2023-03-21,2252,Rio Anapu-Pacaja REDD Project,Brazil (BR),Avoided Def.,2017,333,Carbon Financial Services Pty Ltd,Keywords Australia,Cancelled on behalf of Keywords Australia for its Climate Active organisational certification in FY2022-23
58,2023-03-21,985,Cordillera Azul National Park REDD Project,Peru (PE),Avoided Def.,2017,1147,Carbon Financial Services Pty Ltd,AAM Commercial,Cancelled on behalf of AAM Commercial for its Climate Active Organisation and service certifications
59,2023-03-21,2379,Huadu Afforestation Project,China (CN),ARR,2017,218,,,
62,2023-03-21,2379,Huadu Afforestation Project,China (CN),ARR,2017,172,,,
70,2023-03-21,173,Vishnuprayag Hydro-electric Project (VHEP) by Jaiprakash Power Ventures Ltd.(JPVL),India (IN),Hydro,2007,50,Fokus-Zukunft GmbH & Co. KG,UNIGRUPPE & Handelshaus Kiennast,UNIGRUPPE & Handelshaus Kiennast
71,2023-03-21,2606,Fujian Qingliu IFM (conversion of logged to protected forest) Project,China (CN),IFM,2017,179,"Shanghai Treasure carbon New Energy Environmental Protection Technology Co., Ltd","China Quality Certification Centre No.INV-2023-ZLSW-0012,GHG Emission Removal,Beijing Dacheng Law Offices,LLP.(Shanghai),from 2022.1.1-2022.12.31",2022.1.1-2022.12.31 GHG Emission Removal
