811,3032,Global Cookstove Program (EKI Phase 13),EKI Energy Services Limited,Energy demand,,VMR0006,Under development,India,50552.0,Asia,,2021-12-01,2028-11-30,
812,3033,Global Cookstove Program (EKI Phase 14),EKI Energy Services Limited,Energy demand,,VMR0006,Under development,India,50552.0,Asia,,2021-12-01,2028-11-30,
813,3034,Global Cookstove Program (EKI Phase 15),EKI Energy Services Limited,Energy demand,,VMR0006,Under development,India,50552.0,Asia,,2021-12-01,2028-11-30,
814,3035,Global Cookstove Program (EKI Phase 16),EKI Energy Services Limited,Energy demand,,VMR0006,Under development,India,50552.0,Asia,,2021-12-01,2028-11-30,
815,3036,Global Cookstove Program (EKI Phase 17),EKI Energy Services Limited,Energy demand,,VMR0006,Under development,India,50552.0,Asia,,2021-12-01,2028-11-30,
816,3037,Global Cookstove Program (EKI Phase 18),EKI Energy Services Limited,Energy demand,,VMR0006,Under development,India,50552.0,Asia,,2021-12-01,2028-11-30,
817,3039,Global Cookstove Program (EKI Phase 20),EKI Energy Services Limited,Energy demand,,VMR0006,Under development,India,50552.0,Asia,,2021-12-01,2028-11-30,
818,3041,EZVOLT - EV CHARGING NETWORK CARBON CREDITS PROJECT,Easy Volt Brasil,Transport,,VM0038,Under development,Brazil,14067.0,Latin America,,2021-07-29,2031-07-28,
819,3025,CSD Wastewater Treatment Plant Project in Hebei Province,"CSD Water Service Co., Ltd.",Waste handling and disposal,,AM0080,Registered,China,117143.0,Asia,2023-03-10,2021-01-01,2030-12-31,
820,3024,Puwangzi Afforestation Project,"Guizhou Yuanda Carbon Forestry Development Co., Ltd",Agriculture Forestry and Other Land Use,REDD,AR-ACM0003,Under development,China,402903.0,Asia,,2019-09-10,2049-09-09,
821,3021,Reducing Gas Leakages within North West and other sub-areas of the Titas Gas Distribution Network in Bangladesh,Carbon Projects LLC,"Fugitive emissions from fuels (solid, oil and gas)",,AM0023,Registered,Bangladesh,1090993.0,Asia,2022-10-26,2022-06-01,2032-05-31,
822,3020,Dongyang Wastewater Treatment Plant Project,"CSD Water Service Co., Ltd.",Waste handling and disposal,,AM0080,Registration and verification approval requested,China,64548.0,Asia,,2020-10-25,2030-10-24,
823,3017,Jiangsu REO-ECO PET RECYCLING PROJECT,"Jiangsu REO-ECO New Material Tech Co., Ltd",Waste handling and disposal,,AMS-III.AJ1,Under development,China,10247.0,Asia,,2022-08-01,2032-07-31,
824,3019,REGENERATING DEGRADED LANDS IN FLORIDA THROUGH PONGAMIA,Multiple Proponents,Agriculture Forestry and Other Land Use,ARR,AR-AMS0007,Under development,United States,4133.0,North America,,2018-07-16,2038-07-15,
825,3018,BigCoast Forest Climate Initiative,Mosaic Forest Management Corporation,Agriculture Forestry and Other Land Use,IFM,VM0012,Registration and verification approval requested,Canada,715834.0,North America,,2018-01-01,2047-12-31,
826,3016,Guoyang MSW Landfill Site LFG Recovery and Comprehensive Utilization Project,"Henan BCCY Environmental Energy CO.,LTD.",Energy industries (renewable/non-renewable sources); Waste handling and disposal,,ACM0001,Registration requested,China,62295.0,Asia,,2021-01-18,2031-01-17,
827,3011,Mengzi MSW Landfill Site LFG Comprehensive Utilization and Power Generation Project,"Henan BCCY Environmental Energy CO.,LTD.",Energy industries (renewable/non-renewable sources); Waste handling and disposal,,AMS-I.D.; AMS-III.G.,Registration requested,China,50234.0,Asia,,2021-10-01,2031-09-30,
828,3012,Agroforestry and Reforestation for Carbon Sequestration in Indonesia,The PURE PROJECT SAS,Agriculture Forestry and Other Land Use,ARR,AR-AMS0007,Under development,Indonesia,1888.0,Asia,,2021-08-20,2051-08-19,
829,3014,Patagonia Region Improved Grazing Project,"Native, a Public Benefit Corporation",Agriculture Forestry and Other Land Use,ALM,VM0026,Under development,Argentina,24952.0,,,2022-04-01,2042-03-31,
830,3015,Northern Great Plains Regenerative Grazing Project 2,"Native, a Public Benefit Corporation",Agriculture Forestry and Other Land Use,ALM,VM0026,Under development,United States,17000.0,North America,,2022-05-01,2042-04-30,
831,3010,Macaúbas Landfill Gas Project,Converted from other GHG program,Energy industries (renewable/non-renewable sources); Waste handling and disposal,,ACM0001,Units Transferred from Approved GHG Program,Brazil,102583.0,Latin America,,2020-07-31,2027-07-30,
832,3008,Grouped Captive Solar Power project by Enking International,EKI Energy Services Limited,Energy industries (renewable/non-renewable sources),,AMS-I.E.,Registration and verification approval requested,India,1630.0,Asia,,2020-12-17,2027-12-16,
833,3007,Installation of high efficiency cookstoves in India by AGS Carbon,AGS Carbon Advisory,Energy demand,,VMR0006,Registered,India,333938.0,,2022-11-14,2022-06-06,2029-06-05,
834,3006,Taiqian County MSW Landfill Site LFG Comprehensive Utilization Project,"Henan BCCY Environmental Energy CO.,LTD.",Energy industries (renewable/non-renewable sources); Waste handling and disposal,,AMS-I.D.; AMS-III.G.,Registered,China,43296.0,Asia,2022-12-27,2021-07-31,2031-07-30,
835,3005,Tongxu Biogas Recovery and Utilization Project,"Tongxu Agro-pastoral Co., Ltd.","Livestock, enteric fermentation, and manure management; Waste handling and disposal",,ACM0010,Registered,China,123018.0,Asia,2022-10-27,2020-07-15,2030-07-14,
836,3000,Nankang District MSW Landfill Site LFG Recovery and Comprehensive Utilization Project,"Henan BCCY Environmental Energy CO.,LTD.",Energy industries (renewable/non-renewable sources); Waste handling and disposal,,ACM0001,Registration requested,China,133226.0,Asia,,2021-07-13,2031-07-12,
837,3003,Barry Callebaut feed additive grouped project,Barry Callebaut Sourcing AG,"Livestock, enteric fermentation, and manure management",,VM0041,Registration requested,United States,232480.0,North America,,2020-09-01,2027-08-31,
838,3002,Hiwi REDD+ Project,Multiple Proponents,Agriculture Forestry and Other Land Use,REDD,VM0015,Registration and verification approval requested,Brazil,88084.0,Latin America,,2019-08-31,2049-08-30,
839,2999,Cleaner cooking access in lower Himalayan region,Multiple Proponents,Energy demand,,VMR0006,Registration requested,Nepal,809209.0,Asia,,2022-12-01,2032-11-30,
840,3001,Jiangxi Tonggu Improved Forest Management Project,"Jiangxi Huapeng Industrial Co., Ltd",Agriculture Forestry and Other Land Use,IFM,VM0010,Registration requested,China,51607.0,Asia,,2017-11-01,2047-10-31,
841,3004,Ontario Sustainable Community (OSC),Will Solutions Inc,Energy demand; Waste handling and disposal,,VM0018,Under development,Canada,7182562.0,North America,,2022-01-01,2028-12-31,
842,2998,Brascarbon Methane Recovery Project BCA-BRA-16,Brascarbon Consultoria Projetos e Representação S/A,Waste handling and disposal,,AMS-III.D.,Registration and verification approval requested,Brazil,55356.0,Latin America,,2021-01-02,2028-01-01,
843,2997,Blue Ocean Barns - Brominata Enteric Methane Demonstration Project,Blue Ocean Barns,"Livestock, enteric fermentation, and manure management",,VM0041,Under development,United States,835.0,North America,,2022-06-01,2029-05-31,
844,2996,NATURE GENERATOR ONE  Northern Mexico Sustainable Grazing Carbon Capture Project,Multiple Proponents,Agriculture Forestry and Other Land Use,ALM; ARR,VM0026,Under development,Mexico,152864.0,North America,,2022-02-01,2052-01-31,
845,2993,Grouped rooftop solar power project by SAEL Limited,SAEL Limited,Energy industries (renewable/non-renewable sources),,AMS-I.F.,Registration and verification approval requested,India,5860.0,Asia,,2021-03-12,2028-03-11,
846,2992,HG Afforestation Through High Quality Timber Over Degraded Grasslands,Pike Carbosur S.A.,Agriculture Forestry and Other Land Use,ARR,AR-ACM0003,Registration and verification approval requested,Uruguay,2056.0,Latin America,,2020-10-20,2120-10-19,
847,2989,Solar Water Pump Project in Kenya,SunCulture,Energy industries (renewable/non-renewable sources),,AMS-I.B.,Registered,Kenya,334824.0,Africa,2022-12-06,2020-08-01,2027-07-31,
848,2991,Poultry Litter to CBG Project by M/s Solika Energy Pvt. Ltd.,Solika Energy Pvt. Ltd.,Waste handling and disposal,,AMS-III.D.,Under development,India,50159.0,Asia,,2022-03-31,2029-03-30,
849,2988,TOROS MERAM BIOGAS PLANT,Multiple Proponents,"Energy industries (renewable/non-renewable sources); Livestock, enteric fermentation, and manure management; Waste handling and disposal",,ACM0010,Under validation,Turkey,312838.0,Europe,,2020-11-27,2030-11-26,
850,2986,ANATOLIA LANDFILL GAS (LFG) CAPTURE AND UTILIZATION PROJECT,Multiple Proponents,Energy industries (renewable/non-renewable sources); Waste handling and disposal,,AMS-I.D.; AMS-III.G.; AMS-III.AO.,Registration requested,Turkey,36353.0,Middle East,,2019-10-29,2026-10-28,
851,2985,CO2 INJECTION AND USE OF OTHER MATERIALS TO REDUCE CEMENT CONTENT IN CONCRETE,Ozinga,Construction,,VM0043,Under development,United States,128114.0,North America,,2021-06-01,2031-05-31,
852,2984,Rwandan Improved Cookstove Project,Likano Project Development GmbH,Energy demand,,VMR0006,Under development,Rwanda,1153355.0,,,2022-07-01,2032-06-30,
853,2983,Distribution Of high Efficient Cook Stoves,Green Solutions,Energy demand,,VMR0006,Registration requested,India,49197.0,,,2020-12-24,2027-12-23,
854,2982,BioLite Improved Cook stoves Programme,Converted from other GHG program,Energy demand,,AMS-II.G.,Units Transferred from Approved GHG Program,Kenya,11005.0,Africa,,2018-01-19,2025-01-18,
855,2981,Installation of high efficiency wood burning cookstoves in Angola – Project 2,C-Quest Capital SG Angola Stoves Private Limited,Energy demand,,VMR0006,Registered,Angola,2567788.0,Africa,2023-03-03,2021-09-01,2031-08-31,
856,2980,Feijó REDD+ Project,Multiple Proponents,Agriculture Forestry and Other Land Use,REDD,VM0007; VM0015,Under development,Brazil,116036.0,Latin America,,2019-01-02,2029-01-01,
857,2977,Biomass Cogeneration Plant By SCOUL,Multiple Proponents,Energy industries (renewable/non-renewable sources),,ACM0006,Registration and verification approval requested,Uganda,76243.0,Africa,,2021-07-19,2028-07-18,
858,2971,OKA 2 PROJECT,Acacia Batéké Capital,Agriculture Forestry and Other Land Use,ARR,AR-ACM0003,Registration requested,Congo,19976.0,Africa,,2020-08-01,2053-07-31,
859,2972,Sustainable Agriculture Land Management Project by Earthallica Naturals,EKI Energy Services Limited,Agriculture Forestry and Other Land Use,ALM,VM0017,Under development,India,20000.0,Asia,,2017-07-01,2027-06-30,
860,2974,Aztlan Blue Carbon Mangrove CONSERVATION project - Conserving the Marismas NACIONALES of Nayarit,BlueMX Mangrove A.C.,Agriculture Forestry and Other Land Use,REDD; WRC,VM0007,Under development,Mexico,323590.0,North America,,2016-06-14,2056-06-13,
861,2975,"U' Balam'moo A'kalché ó Blue Carbon Mangrove Conservation Project, Conserving Coastal Ecosystems in Campeche to Support Life",BlueMX Mangrove A.C.,Agriculture Forestry and Other Land Use,REDD; WRC,VM0007,Under development,Mexico,667276.0,North America,,2016-06-14,2056-06-13,
862,2976,"Uh lu'umil Zazil-ha Blue Carbon Mangrove Conservation Project, Conserving Coastal Ecosystems in Quintana Roo to Support Life",BlueMX Mangrove A.C.,Agriculture Forestry and Other Land Use,REDD; WRC,VM0007,Under development,Mexico,1718.0,North America,,2016-06-14,2056-06-13,
863,2968,Replacement of ICLs by LED lamps in India,AGS Carbon Advisory,Energy demand,,AMS-II.C.,Registered,India,53799.0,Asia,2023-02-10,2022-06-24,2032-06-23,
864,2966,"Installation Of Solar Milling Plants for Household In Zambia, Project- 1",Carbon Project Australia Pty Ltd,Energy industries (renewable/non-renewable sources),,AMS-I.B.,Registration requested,Zambia,23199.0,Africa,,2020-08-01,2027-07-31,
865,2967,"Installation Of Solar Milling Plants for Household In Zambia, Project- 2",Carbon Project Australia Pty Ltd,Energy industries (renewable/non-renewable sources),,AMS-I.B.,Registration requested,Zambia,21530.0,Africa,,2020-08-17,2027-08-16,
866,2965,Niger Acacia Senegal Plantation Project CER,Converted from other GHG program,Agriculture Forestry and Other Land Use,ARR,AR-ACM0003,Units Transferred from Approved GHG Program,Niger,24957.0,Africa,,2005-12-21,2035-12-20,
867,2964,POLATLI ENERBES BIOGAS PROJECT,Multiple Proponents,Waste handling and disposal,,AM0073,Registered,Turkey,529923.0,Middle East,2023-02-03,2020-06-12,2027-06-11,
868,2959,Reforestation Project in Meghalaya by Shillong Bamboo,Shillong Bamboo,Agriculture Forestry and Other Land Use,ARR,AR-ACM0003,Under development,India,100000.0,Asia,,2017-07-01,2037-06-30,
869,2958,Lanao del Sur Bamboo Reforestation Project,EcoPlanet Bamboo Group,Agriculture Forestry and Other Land Use,ARR,ACM0003,Registration requested,Philippines,315067.0,,,2022-06-01,2042-05-31,
870,2957,Wuhan Chenjiachong Landfill Gas Power Generation Project Phase II,"Wuhan Jianghuan OneCarbon Energy Development Co., Ltd.",Energy industries (renewable/non-renewable sources); Waste handling and disposal,,ACM0001,Registered,China,167482.0,Asia,2022-10-01,2020-07-14,2030-07-13,
871,2951,Liaoning Xinwang Swine Farm Manure Management System GHG Mitigation Project,"Kangping Xinwang agriculture and animal husbandry Co., Ltd.","Energy industries (renewable/non-renewable sources); Livestock, enteric fermentation, and manure management; Waste handling and disposal",,ACM0010,Registered,China,201850.0,Asia,2022-12-12,2020-08-01,2027-07-31,
872,2954,Distribution of ONIL stoves – Project 1,C-Quest Capital Stoves Asia Limited,Energy demand,,VMR0006,Registration requested,Guatemala,133198.0,Latin America,,2021-01-01,2030-12-31,
873,2955,Distribution of ONIL stoves – Project 2,C-Quest Capital Stoves Asia Limited,Energy demand,,VMR0006,Registration requested,Guatemala,346064.0,Latin America,,2021-02-24,2031-02-23,
874,2952,Not Hot Afforestation project,Not Hot Environmental Solutions,Agriculture Forestry and Other Land Use,ARR,ACM0003,Under development,Latvia,55.0,Europe,,2022-04-01,2062-03-31,
875,2953,Malawi Solar Power and Adult Literacy Project,SCB Brokers LLC,Energy demand; Energy distribution; Energy industries (renewable/non-renewable sources),,AMS-I.A.,Under development,Malawi,21.0,Africa,,2021-11-01,2028-10-31,
876,2938,Yunshui Wastewater Treatment Plant Project in Guangdong Province,"Yunshui Guangdong Environmental Protection Co., Ltd.",Waste handling and disposal,,AM0080,Registered,China,83042.0,Asia,2023-03-09,2020-09-03,2030-09-02,
877,2939,Global Cookstove Program (EKI Phase 01),EKI Energy Services Limited,Energy demand,,VMR0006,Registered,India,190438.0,Asia,2023-02-01,2021-12-21,2028-12-20,
878,2940,GLOBAL COOKSTOVE PROGRAM (EKI - Pink City),EKI Energy Services Limited,Energy demand,,VMR0006,Under development,India,50552.0,Asia,,2021-12-01,2042-11-30,
879,2941,Global Cookstove Program (EKI Phase 03),EKI Energy Services Limited,Energy demand,,VMR0006,Under development,India,50552.0,Asia,,2021-12-01,2042-11-30,
880,2942,Clean Cooking - Cook Stove for Rural India,EKI Energy Services Limited,Energy demand,,VMR0006,Under development,India,50552.0,Asia,,2021-12-01,2042-11-30,
881,2943,Global Cookstove Program (EKI Phase 05),EKI Energy Services Limited,Energy demand,,VMR0006,Under development,India,50552.0,Asia,,2021-12-01,2042-11-30,
882,2944,Clean Cookstoves for Rural India,EKI Energy Services Limited,Energy demand,,VMR0006,Under development,India,50552.0,Asia,,2021-12-01,2042-11-30,
883,2949,"Improved Cookstove Distribution in Kayonza, Bugesera and Nyamasheke Districts of Rwanda",co2balance UK,Energy demand,,VMR0006,Under development,Rwanda,252537.0,Africa,,2021-08-24,2031-08-23,
884,2945,Global Cookstove Program (EKI Phase 07),EKI Energy Services Limited,Energy demand,,VMR0006,Registration requested,India,6956.0,Asia,,2023-02-15,2030-02-14,
885,2946,Global Cookstove Program (EKI Phase 08),EKI Energy Services Limited,Energy demand,,VMR0006,Registration requested,India,6956.0,Asia,,2023-02-15,2030-02-14,
886,2947,Global Cookstove Program (EKI Phase 09),EKI Energy Services Limited,Energy demand,,VMR0006,Registration requested,India,6956.0,Asia,,2023-02-15,2030-02-14,
887,2948,Global Cookstove Program (EKI Phase 10),EKI Energy Services Limited,Energy demand,,VMR0006,Registration requested,India,6993.0,Asia,,2023-01-30,2030-01-29,
888,2950,Atlantic Forest Biodiversity Conservation Limeira Project REDD,Multiple Proponents,Agriculture Forestry and Other Land Use,REDD,VM0007,Under validation,Brazil,11266.0,Latin America,,2017-01-01,2046-12-31,
889,2937,Hubei Yunyang IFM (CONVERSION OF LOGGED TO PROTECTED FOREST) PROJECT,"Shiyan Lvxin Guangjing New Energy Co., Ltd.",Agriculture Forestry and Other Land Use,IFM,VM0010,Registration requested,China,37754.0,Asia,,2018-01-01,2037-12-31,
890,2936,Hunan Cili IFM (conversion of logged to protected forest) Project,Hunan Cili Jiangya Forest Farm,Agriculture Forestry and Other Land Use,IFM,VM0010,Registration requested,China,44014.0,Asia,,2018-01-01,2037-12-31,
891,2934,Boomitra Carbon Farming in the Indo-Gangetic Plains,Boomitra Inc,Agriculture Forestry and Other Land Use,ALM,VM0042,Under development,India,350000.0,Asia,,2018-09-01,2038-08-31,
892,2933,Solve for Carbon Neutrality - LTI’s Afforestation Program,Multiple Proponents,Agriculture Forestry and Other Land Use,ARR,AR-AMS0007,Under development,India,956.0,,,2017-07-22,2037-07-21,
893,2932,4B EREGLI LFG POWER PLANT,Multiple Proponents,Energy industries (renewable/non-renewable sources); Waste handling and disposal,,ACM0001,Registration requested,Turkey,28568.0,Europe,,2020-12-20,2027-12-19,
894,2931,Grassland Restoration and Stewardship in South Africa (GRASS),Multiple Proponents,Agriculture Forestry and Other Land Use,ALM,VM0042,Registration requested,South Africa,465123.0,Africa,,2021-12-01,2051-11-30,
895,2930,Reducing Gas Leakages within the Titas Gas Distribution Network in Bangladesh Verra,NE Climate A/S,"Fugitive emissions from fuels (solid, oil and gas)",,AM0023,Registered,Bangladesh,3289487.0,Asia,2022-12-13,2017-01-29,2027-01-28,
896,2928,North Bandai Bamboo Reforestation Project,EcoPlanet Bamboo Group,Agriculture Forestry and Other Land Use,ARR,AR-ACM0003,Registration requested,Ghana,107907.0,Africa,,2021-06-01,2041-05-31,
897,2929,"Bandai Hills Bamboo Reforestation Project, Ghana",EcoPlanet Bamboo Group,Agriculture Forestry and Other Land Use,ARR,AR-ACM0003,Registration requested,Ghana,188926.0,Africa,,2022-06-01,2042-05-31,
898,2926,XINJIANG MARKIT COUNTY WINDBREAK AND SAND FIXATION ECOLOGICAL FOREST CONSTRUCTION BASE PROJECT,Shenzhen Vanke Millennial Development Co. Ltd.,Agriculture Forestry and Other Land Use,ARR; IFM; REDD,AR-ACM0003,Rejected by Administrator,China,768220.0,Asia,,2017-02-03,2077-02-02,
899,2923,Grouped Projects for Viet Nam Cookstove Program.,Sustainability Investment Promotion and Development Joint Stock Company,Energy demand,,VMR0006,Registered,Viet Nam,61065.0,Asia,2022-11-25,2022-01-07,2032-01-06,
900,2924,Grouped Projects for Laos Improved Cookstove,Sustainability Investment Promotion and Development Joint Stock Company,Energy demand,,VMR0006,Registration requested,Lao,5121563.0,Asia,,,,
901,2925,Grouped Projects for Cambodia Improved Cookstove,Sustainability Investment Promotion and Development Joint Stock Company,Energy demand,,VMR0006,Registration requested,Cambodia,7172213.0,Asia,,2022-05-01,2032-04-30,
902,2921,Jilin Baishishan Afforestation Project,"Jilin Forest Industry Environmental Technology Co., Ltd.",Agriculture Forestry and Other Land Use,ARR,ACM0003,Under development,China,375403.0,Asia,,2017-06-11,2077-06-10,
903,2922,IMPROVED COOKSTOVES FOR COMMUNITIES BY INFINITE SOLUTIONS,Outreach Projects Pvt. Ltd.,Energy demand,,VMR0006,Under development,India,423122.0,,,2021-11-20,2028-11-19,
904,2917,Adjusted Water Management in Rice Cultivation in Shengzhou City,"Hangzhou Chunmeng Agricultural Technology Co., Ltd",Agriculture Forestry and Other Land Use,ALM,AMS-III.AU,Registered,China,59727.0,Asia,2023-01-25,2018-06-11,2025-06-10,
905,2915,Adjusted Water Management in Rice Cultivation in Jiashan County,"Hangzhou Chunmeng Agricultural Technology Co., Ltd",Agriculture Forestry and Other Land Use,ALM,AMS-III.AU,Registration and verification approval requested,China,59904.0,Asia,,2018-06-07,2025-06-06,
906,2916,Linjianchun Adjusted Water Management in Rice Cultivation,"Hangzhou Chunmeng Agricultural Technology Co., Ltd",Agriculture Forestry and Other Land Use,ALM,AMS-III.AU,Registration and verification approval requested,China,59905.0,Asia,,2018-06-13,2025-06-12,
907,2918,Adjusted Water Management in Rice Cultivation in Changxing County,"Hangzhou Chunmeng Agricultural Technology Co., Ltd",Agriculture Forestry and Other Land Use,ALM,AMS-III.AU,Registration and verification approval requested,China,59803.0,Asia,,2018-06-14,2025-06-13,
908,2919,Adjusted Water Management in Rice Cultivation in Western Zhuji City,"Hangzhou Chunmeng Agricultural Technology Co., Ltd",Agriculture Forestry and Other Land Use,ALM,AMS-III.AU,Registration and verification approval requested,China,59882.0,Asia,,2018-06-17,2025-06-16,
909,2900,Adjusted Water Management in Rice Cultivation In Daye City,"Wuhan Haimingsen Environmental Protection Technology Co., Ltd.",Agriculture Forestry and Other Land Use,ALM,AMS-III.AU,Registration and verification approval requested,China,59949.0,Asia,,2020-05-03,2027-05-02,
910,2914,BONOS LAGUNA SÍJIL NOH-HÁ,Ban.CO2 de Carbono Mestizo,Agriculture Forestry and Other Land Use,IFM,VM0003,Under development,Mexico,516815.0,Latin America,,2017-06-15,2047-06-14,
911,2901,Adjusted Water Management in Rice Cultivation In Hanchuan City,"Wuhan Haimingsen Environmental Protection Technology Co., Ltd.",Agriculture Forestry and Other Land Use,ALM,AMS-III.AU,Registration and verification approval requested,China,59832.0,Asia,,2018-05-10,2025-05-09,
912,2906,Adjusted Water Management in Rice Cultivation In Xiaonan District,"Wuhan Haimingsen Environmental Protection Technology Co., Ltd.",Agriculture Forestry and Other Land Use,ALM,AMS-III.AU,Registration and verification approval requested,China,59896.0,Asia,,2018-05-01,2025-04-30,
913,2907,Adjusted Water Management in Rice Cultivation In Yangxin County,"Wuhan Haimingsen Environmental Protection Technology Co., Ltd.",Agriculture Forestry and Other Land Use,ALM,AMS-III.AU,Registration and verification approval requested,China,59923.0,Asia,,2020-05-05,2027-05-04,
914,2908,Biomass Cookstove Project in Meghalaya,Multiple Proponents,Energy demand,,VMR0006,Registration and verification approval requested,India,44163.0,,,2021-04-01,2031-03-31,
915,2899,Adjusted Water Management in Rice Cultivation In Dawu County,"Wuhan Haimingsen Environmental Protection Technology Co., Ltd.",Agriculture Forestry and Other Land Use,ALM,AMS-III.AU,Registered,China,59923.0,Asia,2022-08-08,2018-05-08,2025-05-07,
916,2902,Adjusted Water Management in Rice Cultivation In Huangmei County,"Wuhan Haimingsen Environmental Protection Technology Co., Ltd.",Agriculture Forestry and Other Land Use,ALM,AMS-III.AU,Registered,China,59901.0,Asia,2022-08-08,2018-05-10,2025-05-09,
917,2903,Adjusted Water Management in Rice Cultivation In Xiaochang County,"Wuhan Haimingsen Environmental Protection Technology Co., Ltd.",Agriculture Forestry and Other Land Use,ALM,AMS-III.AU,Registered,China,59916.0,Asia,2022-08-08,2018-05-03,2025-05-02,
918,2909,Adjusted Water Management in Rice Cultivation In Yingcheng City,"Wuhan Haimingsen Environmental Protection Technology Co., Ltd.",Agriculture Forestry and Other Land Use,ALM,AMS-III.AU,Registered,China,59902.0,Asia,2022-08-18,2018-05-07,2025-05-06,
919,2910,Wude Adjusted Water Management in Rice Cultivation,"Hangzhou Chunmeng Agricultural Technology Co., Ltd",Agriculture Forestry and Other Land Use,ALM,AMS-III.AU,Registered,China,59751.0,Asia,2023-01-25,2020-06-15,2027-06-14,
920,2911,Adjusted Water Management in Rice Cultivation in Haiyan County,"Hangzhou Chunmeng Agricultural Technology Co., Ltd",Agriculture Forestry and Other Land Use,ALM,AMS-III.AU,Registered,China,59882.0,Asia,2023-01-25,2020-06-10,2027-06-09,
921,2912,Adjusted Water Management in Rice Cultivation in Tongxiang City,"Hangzhou Chunmeng Agricultural Technology Co., Ltd",Agriculture Forestry and Other Land Use,ALM,AMS-III.AU,Registered,China,59863.0,Asia,2023-01-25,2020-06-06,2027-06-05,
922,2913,Guizhou Yingxing CMM Power Generation Project,"Guizhou Jinyan Energy Technology Co., Ltd.",Energy industries (renewable/non-renewable sources); Mining/mineral production,,ACM0008,Registered,China,104042.0,Asia,2022-10-03,2020-10-01,2030-09-30,
923,2894,Adjusted Water Management in Rice Cultivation In Xinzhou District,"Wuhan Haimingsen Environmental Protection Technology Co., Ltd.",Agriculture Forestry and Other Land Use,ALM,AMS-III.AU,Registered,China,59945.0,Asia,2023-01-27,2018-05-07,2025-05-06,
924,2897,Forest Conservation in Boumba-et-Ngoko,Carbon Sink Group s.r.l.,Agriculture Forestry and Other Land Use,IFM,VM0010,Registration and verification approval requested,Cameroon,362095.0,Africa,,2018-01-01,2037-12-31,
925,2893,Liaoyuan Afforestation Project,Envision Energy Co. Ltd,Agriculture Forestry and Other Land Use,ARR,AR-ACM0003,Under validation,China,87387.0,Asia,,2017-09-12,2047-09-11,
926,2891,Adjusted Water Management in Rice Cultivation In Jiangxia District,"Wuhan Haimingsen Environmental Protection Technology Co., Ltd.",Agriculture Forestry and Other Land Use,ALM,AMS-III.AU,Registered,China,59924.0,Asia,2023-01-27,2018-05-04,2025-05-03,
927,2892,Adjusted Water Management in Rice Cultivation In Wuxue City,"Wuhan Haimingsen Environmental Protection Technology Co., Ltd.",Agriculture Forestry and Other Land Use,ALM,AMS-III.AU,Registered,China,59919.0,Asia,2023-01-27,2018-05-12,2025-05-11,
928,2895,Guizhou Jinyan CMM Power Generation Project,"Guizhou Jinyan Energy Technology Co., Ltd.",Energy industries (renewable/non-renewable sources); Mining/mineral production,,ACM0008,Registered,China,160655.0,Asia,2022-12-07,2020-10-01,2030-09-30,
