2589,1129,3 MW bundled wind Power Project in Tamil Nadu,Multiple Proponents,Energy industries (renewable/non-renewable sources),,AMS-I.D.,Registered,India,6115.0,Asia,2019-02-13,,,
2590,1189,Shandong Taipingshan Wind Farm Project,"Anqiu Taipingshan Wind Power Co., Ltd.",Energy industries (renewable/non-renewable sources),,ACM0002,Registered,China,84740.0,,2014-01-10,,,
2591,1188,Shandong Wendeng Zhangjiachan Wind Farm Project,"Wendeng Zhangjiachan Wind Power Co., Ltd.",Energy industries (renewable/non-renewable sources),,ACM0002,Registered,China,84709.0,Asia,2014-01-13,,,
2592,1187,Shandong Yishui Tangwangshan Wind Farm Project,"Yishui Tangwangshan Wind Power Co., Ltd.",Energy industries (renewable/non-renewable sources),,ACM0002,Registered,China,35438.0,,2020-04-06,,,
2593,1723,Escuela de Minas Hydroelectric Project,HIDROELECTRICA DEL ALTO PORCE,Energy industries (renewable/non-renewable sources),,ACM0002,Registered,Colombia,83524.0,Latin America,2017-11-02,2019-07-22,2029-07-21,
2594,669,Wind Energy project by Ramco group in india,Multiple Proponents,Energy industries (renewable/non-renewable sources),,ACM0002,Registered,India,299591.0,Asia,2020-04-06,2016-03-28,2026-03-27,
2595,727,CECIC HKE Zhangbei Lvnaobao Wind Power Project,"CECIC HKE Wind Power CO.,LTD",Energy industries (renewable/non-renewable sources),,ACM0002,Registered,China,235797.0,Asia,2020-04-06,,,
2596,1720,ONIL Stoves —Guatemala – CPA 002,Multiple Proponents,Energy demand,,VMR0006,Registered,Guatemala,42773.0,Latin America,2020-09-04,2015-04-20,2025-04-19,
2597,1721,ONIL Stoves  Guatemala Uspantan,HELPS International Incorporated,Energy demand,,VMR0006,Registered,Guatemala,42773.0,Latin America,2020-09-04,2020-12-20,2030-12-19,
2598,1719,Improved Cookstoves Project for Malawi and cross-border regions of Mozambique CPA MAL  005,Multiple Proponents,Energy demand,,AMS-II.G.,Registered,Malawi,44853.0,Africa,2018-02-06,2016-09-05,2026-09-04,
2599,1718,Inner Mongolia Keyihe IFM (conversion of logged to protected forest) Project,Multiple Proponents,Agriculture Forestry and Other Land Use,IFM,VM0010,Registered,China,128563.0,Asia,2020-04-06,2013-01-01,2042-12-31,
2600,1716,Matebe Hydroelectric plant,AERA Group,Energy industries (renewable/non-renewable sources),,AMS-I.L.,Registered,"Congo, The Democratic Republic of The",46414.0,Africa,2017-09-25,2016-03-05,2026-03-04,
2601,810,CEYHAN 61.7 MW Hydropower Project,Enova Enerji Üretim A.Ş.,Energy industries (renewable/non-renewable sources),,ACM0002,Registered,Turkey,118275.0,Asia,2012-04-04,,,
2602,1715,Inner Mongolia Wu‘erqihan IFM (conversion of logged to protected forest) Project,Multiple Proponents,Agriculture Forestry and Other Land Use,IFM,VM0010,Registered,China,293347.0,Asia,2020-04-06,2013-01-01,2042-12-31,
2603,1291,"Hydro Power Project in backward district of Andhra Pradesh, India",Andhra Pradesh Power Generation Corporation Limited,Energy industries (renewable/non-renewable sources),,ACM0002,Registered,India,364520.0,Asia,2014-03-24,2018-08-18,2028-08-17,
2604,1398,Reducing Emissions from Deforestation and Carbon Enhancement in Xe Pian National Protected Area,Provincial Office of Agriculture and Forestry (PAFO),Agriculture Forestry and Other Land Use,REDD,VM0015,Registered,Lao,64981.0,Asia,2017-11-16,2014-09-01,2044-08-31,
2605,1712,Replacement of existing luminaires with LED lighting luminaires in several buildings across 12 Town Councils in Singapore,Multiple Proponents,Energy demand,,AMS-II.C.,Registered,Singapore,13158.0,Asia,2020-04-06,2017-03-04,2027-03-03,
2606,534,Feke II 69.58 MW Hydroelecrtic Power Plant,Akenerji Elektrik Uretim A.S,Energy industries (renewable/non-renewable sources),,ACM0002,Crediting Period Renewal and Verification Approval Requested,Turkey,103126.0,Middle East,2020-04-06,,,
2607,718,Improving Energy Efficiency in Railways' Residential Quarters  Western Region,C-Quest Capital Malaysia Limited,Energy demand,,AMS-II.J.,Registered,India,24000.0,Asia,2020-04-06,2020-09-01,2030-08-31,
2608,732,Improving Energy Efficiency in Railways' Residential Quarters Eastern Region,Multiple Proponents,Energy demand,,AMS-II.J.,Registered,India,46000.0,Asia,2020-04-06,,,
2609,1711,"Agricultural Land Management project in Telangana, India implemented by Godrej Consumer Products Limited",Godrej Consumer Products Limited,Agriculture Forestry and Other Land Use,ARR; REDD,ACM0017; VM0017,Registration requested,India,33392.0,Asia,,2017-08-01,2037-07-31,
2610,1709,140 MW Solar Photovoltaic Project in Rajasthan,Multiple Proponents,Energy industries (renewable/non-renewable sources),,ACM0002,Registered,India,241573.0,Asia,2019-08-19,2017-07-18,2027-07-17,
2611,1708,Public Lighting Service in the Municipality of San Salvador,UDP CONSORCIO AGM DESARROLLOS,Energy demand,,AMS-II.L.,Registered,El Salvador,8640.0,Latin America,2020-04-06,2016-12-07,2026-12-06,
2612,1022,"Grid Connected Wind Power Project by M/s. D. J. Malpani at Ratan Ka Bas (RKB), Rajasthan",M/s D. J. Malpani,Energy industries (renewable/non-renewable sources),,AMS-I.D.,Registered,India,7497.0,Asia,2013-09-02,2021-12-06,2031-12-05,
2613,724,"53.75 MW Bundled wind Power project in Tamil Nadu  and Karnataka by KBD Group, India",Multiple Proponents,Energy industries (renewable/non-renewable sources),,ACM0002,Registered,India,119382.0,Asia,2020-04-06,,,
2614,1706,3MW Solar PV based power generation by Jindal Poly Films,Jindal Poly Films Limited,Energy industries (renewable/non-renewable sources),,AMS-II.F.,Registered,India,4274.0,Asia,2017-07-28,2016-10-08,2026-10-07,
2615,679,Bundled Wind Power Project by Rajendra Exim Pvt. Ltd.,Multiple Proponents,Energy industries (renewable/non-renewable sources),,AMS-I.D.,Registered,India,124549.0,Asia,2020-04-06,2017-02-28,2027-02-27,
2616,77,Yangcun Hydropower Station Project,"Sichuan Daduhe Power Co., Ltd",Energy industries (renewable/non-renewable sources),,ACM0002,Registered,China,243725.0,Asia,2020-04-06,2019-01-01,2025-12-31,
2617,480,"Reduction in GHGs emission from primary aluminium smelter at Hindalco, Hirakud India",HINDALCO INDUSTRIES LIMITED,Metal production,,AM0059,Registered,India,127319.0,Asia,2010-08-10,,,
2618,52,Nascente Ceramic Fuel Switching Project,Multiple Proponents,Energy industries (renewable/non-renewable sources),,AMS-I.E.,Registered,Brazil,9040.0,Latin America,2020-04-06,,,
2619,1704,"Agricultural Land Management  project in Beed District, India implemented by Godrej Properties Ltd.",Godrej Properties Ltd,Agriculture Forestry and Other Land Use,REDD,VM0017,Registered,India,33764.0,Asia,2020-07-16,2017-07-28,2037-07-27,
2620,708,Engenheiro Ernesto Jorge Dreher and Engenheiro Henrique Kotzian SHPs VCS Project (JUN1120),Multiple Proponents,Energy industries (renewable/non-renewable sources),,ACM0002,Registered,Brazil,52686.0,Latin America,2020-04-06,2019-07-01,2029-06-30,
2621,1701,Nam Mo 3 Hydro Power Project,Credits transferred from approved GHG program,Energy industries (renewable/non-renewable sources),,AMS-I.D.,Units Transferred from Approved GHG Program,Viet Nam,21817.0,Asia,,2019-05-01,2026-04-30,
2622,1702,Durban Landfill-gas-to-electricity project – Mariannhill and La Mercy Landfills,Credits transferred from approved GHG program,Waste handling and disposal,,ACM0001,Units Transferred from Approved GHG Program,South Africa,68833.0,Africa,,2020-12-15,2027-12-14,
2623,1703,Huadian Ningxia Ningdong Yangjiayao 45MW Wind-farm Project,Credits transferred from approved GHG program,Energy industries (renewable/non-renewable sources),,ACM0002,Units Transferred from Approved GHG Program,China,93938.0,Asia,,2022-06-01,2029-05-31,
2624,1700,Incomex Hydroelectric Project,Multiple Proponents,Energy industries (renewable/non-renewable sources),,AMS-I.D.,Registered,Brazil,91220.0,Latin America,2020-11-05,2017-07-01,2024-06-30,
2625,1696,22.5 MW Bhilangana Hydro Power Project (BHPP),Credits transferred from approved GHG program,Energy industries (renewable/non-renewable sources),,ACM0002,Units Transferred from Approved GHG Program,India,32574.0,Asia,,,,
2626,1697,"24 MW Perla Mini Hydel Project, Karnataka, India",Credits transferred from approved GHG program,Energy industries (renewable/non-renewable sources),,ACM0002,Units Transferred from Approved GHG Program,India,6719.0,Asia,,,,
2627,1698,"5 MW Sahu Hydro Electric Project for a grid connected system in Himachal Pradesh, India",Credits transferred from approved GHG program,Energy industries (renewable/non-renewable sources),,AMS-I.D.,Units Transferred from Approved GHG Program,India,9880.0,Asia,,,,
2628,1699,Song Chung Hydropower Project,Credits transferred from approved GHG program,Energy industries (renewable/non-renewable sources),,ACM0002,Units Transferred from Approved GHG Program,Viet Nam,8561.0,Asia,,2017-05-01,2024-04-30,
2629,1695,Scheme of Compensation for Ecosystem Services for Forest Management and Conservation of Water Sources in the Jurisdiction of CORPOCHIVOR,Local Environmental Authority of Chivor (CORPOCHIVOR),Agriculture Forestry and Other Land Use,REDD,VM0015,Registered,Colombia,1662.0,Latin America,2018-01-16,2014-04-11,2044-04-10,
2630,1036,Hillsborough County Waste to Energy (WtE) Facility 2009 Capital Expansion Unit 4,Hillsborough County,Energy industries (renewable/non-renewable sources); Waste handling and disposal,,AM0025,Registered,United States,35000.0,North America,2020-04-06,2019-07-13,2029-07-12,
2631,1764,"Reforestation and Restoration of degraded mangrove lands, sustainable livelihood and community development in Myanmar",Worldview International Foundation,Agriculture Forestry and Other Land Use,ARR; WRC,AR-AM0014,Registered,Myanmar,184006.0,Asia,2017-06-26,2015-06-15,2035-06-14,
2632,361,"5.725 MW Bundled grid-connected wind electricity generation project, Tamil Nadu, India",Multiple Proponents,Energy industries (renewable/non-renewable sources),,AMS-I.D.,Registered,India,11985.0,Asia,2020-04-06,,,
2633,251,Biomass Based Cogeneration Project at Nectar Life Sciences Ltd,Nectar Lifesciences Ltd,Energy industries (renewable/non-renewable sources),,AMS-I.C.,Registered,India,47704.0,Asia,2020-04-06,,,
2634,1693,"Wind Power Project in Maharashtra State, India",Baidyanath Power Private Limited,Energy industries (renewable/non-renewable sources),,AMS-I.D.,Registered,India,16223.0,Asia,2017-10-10,2013-06-08,2023-06-07,
2635,1692,15 MW Wind Power Project by RSPL Ltd (EKIESL-CDM-May-16-04),RSPL Limited,Energy industries (renewable/non-renewable sources),,AMS-I.D.,Withdrawn,India,29758.0,Asia,2017-08-04,2015-12-11,2025-12-10,
2636,1691,5 MW Upper Awa Hydro Power Project in Himachal Pradesh by M/s Astha Projects (India) Limited,M/s Astha Projects (India) Limited,Energy industries (renewable/non-renewable sources),,AMS-I.D.,Registered,India,19411.0,Asia,2017-06-08,,,
2637,1690,Biogas Utilization Project in Zhejiang Jingxing Paper Joint Stock Co. Ltd.,Credits transferred from approved GHG program,Energy industries (renewable/non-renewable sources); Waste handling and disposal,,AMS-III.H.,Units Transferred from Approved GHG Program,China,60577.0,Asia,,,,
2638,1689,Tumring REDD+ Project,"The Royal Government of Cambodia, Forestry Administration",Agriculture Forestry and Other Land Use,REDD,VM0009,Registered,Cambodia,378434.0,Asia,2020-04-06,2015-01-01,2044-12-31,CCB-No Distinction
2639,682,"Wind Power Project at Anthiyur, Tamil Nadu",Windage Power Company (P) LTD,Energy industries (renewable/non-renewable sources),,AMS-I.D.,Registered,India,30928.0,Asia,2020-04-06,2016-04-01,2026-03-31,
2640,83,"Guaraí, Itabira and Santa Izabel Ceramics Fuel Switching Project",Multiple Proponents,Energy industries (renewable/non-renewable sources),,AMS-I.C.,Registered,Brazil,42304.0,Latin America,2020-04-06,2016-04-01,2026-03-31,
2641,1687,Grid connected bundled wind projects in Gujarat and Tamil Nadu,Multiple Proponents,Energy industries (renewable/non-renewable sources),,AMS-I.D.,Under validation,India,6762.0,Asia,,2018-12-15,2025-12-14,
2642,1120,"Vaayu India Wind Power Project in Jaisalmer, Rajasthan",Vaayu (India) Power Corporation Private Limited,Energy industries (renewable/non-renewable sources),,ACM0002,Registered,India,87159.0,Asia,2020-04-06,,,
2643,603,Sirma Run-of-River Hydro Project,Beyobasi Enerji Uretimi A.S.,Energy industries (renewable/non-renewable sources),,AMS-I.D.,Registered,Turkey,12780.0,Middle East,2020-04-06,,,
2644,592,Utilization of jute biomass process waste & other biomass as fuel substituting fossil fuels in steam generation for use on site,East India Commercial Co. Ltd.,Energy industries (renewable/non-renewable sources),,AMS-I.C.,Registered,India,7983.0,Asia,2020-04-06,,,
2645,635,Dak Rung Hydropower Project,Viet Nguyen Construction Works Joint Stock Company,Energy industries (renewable/non-renewable sources),,AMS-I.D.,Registered,Viet Nam,7136.0,Asia,2020-04-06,,,
2646,629,The Korea Energy Foundation (KEF) old refrigerator replacement for lowincome,The Korea Energy Foundation (KEF),Energy demand,,AMS-II.C.,Registered,South Korea,848.0,Asia,2020-04-06,,,
2647,530,Zhumadian Zhongyuan Gas-Steam Combined Cycle Power Project in Henan China,Henan Zhongyuan Gas Power Company Ltd.,Energy industries (renewable/non-renewable sources),,AM0029,Registered,China,858165.0,Asia,2020-04-06,2021-08-25,2028-08-24,
2648,602,Maguary Ceramic Fuel Switching Project,Multiple Proponents,Energy industries (renewable/non-renewable sources),,AMS-I.E.,Registered,Brazil,11677.0,Latin America,2020-04-06,,,
2649,604,Rajwakti Small Scale Hydropower Project,Him Urja Private Limited,Energy industries (renewable/non-renewable sources),,AMS-I.D.,Registered,India,19569.0,Asia,2020-04-06,2016-04-01,2026-03-31,
2650,641,Redd Forests Grouped Project: Protection of Tasmanian Native Forest,Multiple Proponents,Agriculture Forestry and Other Land Use,IFM,VM0010,Registered,Australia,144582.0,Oceania,2020-04-06,,,
2651,535,78 MW AKOCAK Hydroelectric Power Plant,Multiple Proponents,Energy industries (renewable/non-renewable sources),,ACM0002,Crediting Period Renewal Requested,Turkey,144681.0,Middle East,2020-04-06,2020-07-01,2030-06-30,
2652,1686,Agrocortex REDD Project,Agrocortex Madeiras do Acre Agroflorestal Ltda.,Agriculture Forestry and Other Land Use,REDD,VM0015,Registered,Brazil,483594.0,Latin America,2018-04-11,2014-07-01,2044-06-30,
2653,494,Zhangjiagang Nature Gas Power Generation Project,"Zhangjiagang Huaxing Power Co., Ltd.",Energy industries (renewable/non-renewable sources),,AM0029,Registered,China,1231243.0,Asia,2020-04-06,2019-06-08,2026-06-07,
2654,513,Salto Pilão Hydropower Plant Project Activity,Consórcio Empresarial Salto Pilão – CESAP,Energy industries (renewable/non-renewable sources),,ACM0002,Registered,Brazil,186810.0,Latin America,2020-04-06,,,
2655,536,Uluabat Hydroelectric Power Plant,Akenerji Elektrik Uretim A.S,Energy industries (renewable/non-renewable sources),,ACM0002,Registered,Turkey,199467.0,Middle East,2020-04-06,,,
2656,569,Honeywell HFC-23 Destruction Project,Honeywell International Inc.,Fugitive emissions from production and consumption of halocarbons and sulphur hexafluoride,,AM0001,Registered,United States,2469486.0,North America,2020-04-06,,,
2657,557,Kadamane Mini Hydel Scheme-1 (KMHS-1),Paschim Hydro Energy Pvt. Ltd.,Energy industries (renewable/non-renewable sources),,AMS-I.D.,Registered,India,32128.0,,2020-04-06,2017-05-07,2027-05-06,
2658,560,Low pressure steam generation by recovering waste heat using Heat Re-claimers at Emirates CMS Power,Emirates CMS Power Company,Energy industries (renewable/non-renewable sources),,ACM0012,Registered,United Arab Emirates,119069.0,Middle East,2020-04-06,,,
2659,565,40.0 MW DEGIRMENUSTU Hydroelectric Power Plant,DEGIRMENUSTU ENERJI URETIM TICARET VE SANAYI AS,Energy industries (renewable/non-renewable sources),,ACM0002,Registered,Turkey,62386.0,Middle East,2020-04-06,,,
2660,518,Fujian Nanridao 16.15MW Wind Power Project in China,Fujian Putian Nanri Houshanzai Wind Power Generati,Energy industries (renewable/non-renewable sources),,ACM0002,Registered,China,38476.0,Asia,2020-04-06,2019-09-22,2026-09-21,
2661,1685,Grid connected 25 MW PV solar power project at Charanka in Gujarat,GMR Gujarat Solar Power Pvt. Ltd,Energy industries (renewable/non-renewable sources),,ACM0002,Registered,India,34462.0,Asia,2021-03-11,2022-03-04,2032-03-03,
2662,656,Guizhou Qingshuihe Gelibridge Hydropower Project,"Guizhou Wujiang Qingshuihe Hydropower Development Co., Ltd",Energy industries (renewable/non-renewable sources),,ACM0002,Registered,China,387570.0,Asia,2020-04-06,,,
2663,657,"Grid connected electricity generation from renewable sources:Bagisli 29.57 MW Hydroelectric Power Plant Project, Turkey",Ceykar Elektrik Üretim A.S.,Energy industries (renewable/non-renewable sources),,ACM0002,Registered,Turkey,64138.0,Middle East,2020-04-06,2019-06-01,2029-05-31,
2664,661,"8.4 MW Wind Energy Project by Sanwaria Agro Oils Limited, India",Sanwaria Agro Oils Limited,Energy industries (renewable/non-renewable sources),,AMS-I.D.,Registered,India,14875.0,Asia,2020-04-06,,,
2665,698,CAYKARA HYDROELECTRIC POWER PLANT,REDAS Elektrik Uretim Dagitim Pazarlama Sanayi,Energy industries (renewable/non-renewable sources),,ACM0002,Registered,Turkey,59018.0,Middle East,2020-04-06,2022-01-01,2031-12-31,
2666,717,CECIC HKC Gansu Changma Wind Power project,"CECIC HKC Gansu Wind Power Co., LTD.",Energy industries (renewable/non-renewable sources),,ACM0002,Registered,China,430588.0,Asia,2020-04-06,,,
2667,577,AYRANCILAR HYDROELECTRIC POWER PLANT,Multiple Proponents,Energy industries (renewable/non-renewable sources),,ACM0002,Registered,Turkey,68095.0,Middle East,2020-04-06,,,
2668,580,Coc Dam Hydropower Project,Hoang Son Construction Company Limited,Energy industries (renewable/non-renewable sources),,AMS-I.D.,Registered,Viet Nam,16472.0,Asia,2020-04-06,2022-06-10,2029-06-09,
2669,578,Menge Dam and Hydroelectric Plant,Enerjisa Enerji Uretim  A.S.,Energy industries (renewable/non-renewable sources),,ACM0002,Registered,Turkey,100132.0,Middle East,2020-04-06,,,
2670,719,Yunnan Dali Zhemoshan Wind Power Project,Sinohydro 14th Bureau Dali Juneng Investment Co.Lt,Energy industries (renewable/non-renewable sources),,ACM0002,Registered,China,58623.0,Asia,2020-04-06,2017-02-01,2024-01-31,
2671,747,Sefakoy Hydroelectric Power Plant,DEGIRMENUSTU ENERJI URETIM TICARET VE SANAYI AS,Energy industries (renewable/non-renewable sources),,ACM0002,Registered,Turkey,58172.0,Middle East,2020-04-06,,,
2672,613,North Antelope Rochelle Mine CMM Capture and Use Project: Phase II - Porcupine Project,"Camco International Group, Inc.","Fugitive emissions from fuels (solid, oil and gas); Mining/mineral production",,VMR0001,Registered,United States,135102.0,,2020-04-06,,,
2673,623,12.55 MW Wind Power Project In India,Walden Properties Pvt. Ltd.,Energy industries (renewable/non-renewable sources),,AMS-II.D.,Registered,India,27182.0,Asia,2020-04-06,,,
2674,721,Peri-urban bamboo planting around South African townships,Multiple Proponents,Agriculture Forestry and Other Land Use,ARR,AR-AMS0002,Registered,South Africa,16000.0,Africa,2020-04-06,2011-03-01,2031-02-28,
2675,751,"22.5 MW Wind Power Project by Ruchi Soya Industries Limited at Palsodi, District-Ratlam, Madhya Pradesh",Ruchi Soya Industries Limited,Energy industries (renewable/non-renewable sources),,ACM0002,Registered,India,46323.0,Asia,2020-04-06,,,
2676,750,10.2 MW Wind Power Project by Ruchi Infrastructure Limited,Ruchi Infrastructure Limited,Energy industries (renewable/non-renewable sources),,AMS-I.D.,Registered,India,20031.0,Asia,2020-04-06,,,
2677,740,PrairieWinds ND1 (PWND1) Emissions Reduction Project,Basin Electric Power Cooperative,Energy industries (renewable/non-renewable sources),,ACM0002,Crediting Period Renewal and Verification Approval Requested,United States,308580.0,North America,2020-04-06,,,
2678,614,"Chemical Recovery Project at Satia Industries Ltd. (SIL), formerly known as Satia Paper Mills Limited Village Rupana, Punjab",Satia Industries Limited,Chemical industry,,AMS-III.M.,Withdrawn,India,21906.0,Asia,2020-04-06,,,
2679,763,Dogancay HPPs run-of-river hydro project,Elen Enerji Uretimi Sanayi Ticaret A.S.,Energy industries (renewable/non-renewable sources),,ACM0002,Registered,Turkey,94454.0,Middle East,2020-04-06,2014-09-12,2024-09-11,
2680,754,Hubei Lichuan Longqiao Hydropower Station,"Lichuan Yu River Hydropower Co., Ltd.",Energy industries (renewable/non-renewable sources),,ACM0002,Registered,China,158686.0,Asia,2020-04-06,,,
2681,761,Doruk HPP Run-of-River Hydro Project,Yeni Doruk Enerji Elektrik Uretim A.S.,Energy industries (renewable/non-renewable sources),,ACM0002,Registered,Turkey,44303.0,Middle East,2020-04-06,,,
2682,762,"Grid connected electricity generation from renewable sources: Uzuncayir 82.0 MW Hydroelectric Power Plant Project, Turkey",Limak Yatirim Enerji Uretim Isletme Hizmetleri,Energy industries (renewable/non-renewable sources),,ACM0002,Registered,Turkey,98484.0,Middle East,2020-04-06,,,
2683,771,Sarýgüzel Dam and Hydroelectric Power Plants,Enerjisa Enerji Uretim  A.S.,Energy industries (renewable/non-renewable sources),,ACM0002,Registered,Turkey,185811.0,Middle East,2020-04-06,2013-04-01,2023-03-31,
2684,774,Reforestation Across the Lower Mississippi Valley,Dynegy Inc.,Agriculture Forestry and Other Land Use,ARR,AR-ACM0001,Registered,United States,101874.0,North America,2020-04-06,1999-04-05,2059-04-04,
2685,1194,Kaladonger Wind Power Project in Rajasthan,M/s Bindu Vayu Urja Private Limited,Energy industries (renewable/non-renewable sources),,ACM0002,Registered,India,1268170.0,,2020-06-04,2022-02-18,2032-02-17,
2686,753,The Cevizlik Run-of-River Hydroelectric Power Plant,''SANKO Enerji Sanayi ve Ticaret A.Ş,Energy industries (renewable/non-renewable sources),,ACM0002,Registered,Turkey,187471.0,Middle East,2020-04-06,,,
2687,710,Shandong Changdao 27.2 MW Wind Power Project,Huaneng Zhongdian Changdao Wind Power Co. Ltd,Energy industries (renewable/non-renewable sources),,ACM0002,Registered,China,58705.0,Asia,2020-04-06,2021-10-01,2028-09-30,
2688,713,KOYULHISAR HYDRO ELECTRICITY POWER PLANT,Aydem Yenilenebilir Enerji A.Ş.,Energy industries (renewable/non-renewable sources),,ACM0002,Registered,Turkey,116217.0,Middle East,2020-04-06,,,
2689,752,YEDISU 22.71 MW HYDROELECTRIC POWER PLANT PROJECT,Multiple Proponents,Energy industries (renewable/non-renewable sources),,ACM0002,Registered,Turkey,39384.0,Middle East,2020-04-06,2022-02-03,2032-02-02,
2690,704,BHL Biogas and Bagasse based cogeneration project activity at Kinauni,Bajaj Hindusthan Ltd,Energy industries (renewable/non-renewable sources),,AMS-I.C.,Registered,India,67805.0,Asia,2020-04-06,,,
2691,805,Waste Heat based 10 MW captive power project “GPIL- WHRB 2” CDM PROJECT ACTIVITY,Godawari Power and Ispat Ltd.,Energy industries (renewable/non-renewable sources),,ACM0012,Registered,India,50620.0,Asia,2020-04-06,,,
2692,822,BATICIM BATI ANADOLU CIMENTO SANAYII A.S. 9 MW Cement WHR Project,Baticim Bati Anadolu Cimento Sanayii A.S.,Energy industries (renewable/non-renewable sources); Manufacturing industries,,ACM0012,Registered,Turkey,25180.0,Asia,2020-04-06,2022-05-20,2032-05-19,
2693,831,Amayo Phase II Wind Power Project,Consorcio Eólico Amayo (Fase II) S.A.,Energy industries (renewable/non-renewable sources),,ACM0002,Registered,Nicaragua,69915.0,Latin America,2020-04-06,2018-10-01,2025-09-30,
2694,906,Fujian Zhangpu Liuao 3rd phase Wind Power Project,Datang Zhangzhou Wind Power Co. Ltd,Energy industries (renewable/non-renewable sources),,ACM0002,Registered,China,47867.0,Asia,2020-04-06,2016-06-01,2023-05-31,
2695,912,"Gunder Hydro Power Project, Turkey",Arik Enerji Uretim A.S.,Energy industries (renewable/non-renewable sources),,ACM0002,Registered,Turkey,38760.0,Asia,2020-04-06,,,
2696,778,Pirinclik HPP run-of-river hydro project,Enbati Elektrik Uretim Sanayi ve Ticaret A.S,Energy industries (renewable/non-renewable sources),,ACM0002,Registered,Turkey,42280.0,Middle East,2020-04-06,2014-11-14,2024-11-13,
2697,779,Tongcheng Kaidi Biomass Power Project,"Tongcheng Kaidi Green Energy Development Co., Ltd.",Energy industries (renewable/non-renewable sources),,ACM0006,Registered,China,106573.0,Asia,2020-04-06,2018-01-01,2024-12-31,
2698,802,Tra Linh 3 Hydropower Project,Multiple Proponents,Energy industries (renewable/non-renewable sources),,AMS-I.D.,Registered,Viet Nam,15083.0,Asia,2020-04-06,,,
2699,776,Weatherization of Low-Income Dwellings in Maine,Maine Housing,Energy demand,,VM0008,Registered,United States,14382.0,North America,2020-04-06,,,
2700,836,Song Ong Hydropower Project,Song Ong Hydropower Joint Stock Company,Energy industries (renewable/non-renewable sources),,AMS-I.D.,Registered,Viet Nam,21416.0,Asia,2020-04-06,2018-03-01,2025-02-28,
2701,839,Bayou Bartholomew Climate Action Project,The Nature Conservancy,Agriculture Forestry and Other Land Use,ARR,AR-ACM0001,Registered,United States,531.0,North America,2020-04-06,2009-04-09,2073-04-08,
2702,811,Nam Ngan Hydropower Project,Multiple Proponents,Energy industries (renewable/non-renewable sources),,AMS-I.D.,Registered,Viet Nam,29322.0,Asia,2020-04-06,2017-08-01,2024-07-31,
2703,917,ASLANCIK HYDRO POWER PLANT PROJECT,Aslancik Elektrik Üretim A.S.,Energy industries (renewable/non-renewable sources),,ACM0002,Registered,Turkey,222884.0,Middle East,2020-04-06,2013-10-01,2023-09-30,
2704,950,Liaoning Linghai Nanxiaoliu Wind Farm Project,"Guodian Linghai Wind Power Co., Ltd",Energy industries (renewable/non-renewable sources),,ACM0002,Registered,China,122764.0,Asia,2020-04-06,2017-10-01,2024-09-30,
2705,886,"Reforestation of degraded lands in the Valle California of Patagonia, Chile",Agrícola y Forestal SNP Ltda,Agriculture Forestry and Other Land Use,ARR,AR-ACM0001,Registered,Chile,1193.0,Latin America,2020-04-06,2010-04-30,2090-04-29,
