1625,1101,BALKODU 1 HYDRO POWER PLANT,BTA Enerji Elektrik Üretim İnşaat,Energy industries (renewable/non-renewable sources),,AMS-I.D.,Under validation,Turkey,20642.0,Middle East,,,,
1626,1164,Wind Power Project by NACL in Tamil Nadu,Nagarjuna Agrichem Limited,Energy industries (renewable/non-renewable sources),,AMS-I.D.,Under validation,India,11733.0,Asia,,,,
1627,1169,EPM Grouped Natural Gas Project,Empresas Publicas de Medellin S.A,Energy industries (renewable/non-renewable sources); Manufacturing industries,,ACM0009,Under validation,Colombia,6930.0,Latin America,,2022-03-01,2032-02-29,
1628,1223,"Yanhe, Dejiang, and Yinjiang Rural Methane Digesters Project in Guizhou Province, China",Guizhou Black Carbon Energy Tech Prom & App Co. Lt,Energy industries (renewable/non-renewable sources),,AMS-I.C.; AMS-III.R.,Under validation,China,53247.0,Asia,,,,
1629,1224,"Sinan and Shiqian Rural Methane Digesters Project in Guizhou Province, China",Guizhou Black Carbon Energy Tech Prom & App Co. Lt,Energy industries (renewable/non-renewable sources),,AMS-I.C.; AMS-III.R.,Under validation,China,51537.0,Asia,,,,
1630,1243,Xifeng and Xiuwen Rural Biogas Methane Project in Guizhou Province,Guizhou Black Carbon Energy Tech Prom & App Co. Lt,Energy industries (renewable/non-renewable sources),,AMS-I.C.; AMS-III.R.,Under validation,China,52270.0,Asia,,,,
1631,1244,Qingzhen Rural Biogas Methane Project in Guizhou Province,Guizhou Black Carbon Energy Tech Prom & App Co. Lt,Energy industries (renewable/non-renewable sources),,AMS-I.C.; AMS-III.R.,Under validation,China,49217.0,Asia,,,,
1632,1245,Wudang and Huaxi Rural Biogas Methane Project in Guizhou Province,Guizhou Black Carbon Energy Tech Prom & App Co. Lt,Energy industries (renewable/non-renewable sources),,AMS-I.C.; AMS-III.R.,Under validation,China,23887.0,Asia,,,,
1633,1295,Biomass Based Steam Generation Plant,CHANAKYA DAIRY PRODUCTS LIMITED,Energy industries (renewable/non-renewable sources),,AMS-I.C.,Under validation,India,27422.0,Asia,,2022-04-10,2032-04-09,
1634,1298,Biomass Based Steam Generation Project by Industrial Progressive India Limited,Industrial Progressive India Limited,Energy industries (renewable/non-renewable sources),,AMS-I.C.,Under validation,India,33700.0,Asia,,2022-07-17,2032-07-16,
1635,1305,CIty and County of Honolulu Solid Waste to Energy Facility - 3RD Boiler Expansion,"City of Honolulu, Department of Environmental Serv",Energy industries (renewable/non-renewable sources),,ACM0022; Methodology Under Development,Under validation,United States,25620.0,North America,,,,
1636,1307,Biomass Based Steam Generation Plant Farmgate Agro Milch,FARMGATE AGRO MILCH PRIVATE LIMITED,Energy industries (renewable/non-renewable sources),,AMS-I.C.,Under validation,India,38960.0,Asia,,2013-06-26,2023-06-25,
1637,1341,8.40MW Bundled Wind Power Project in Rajasthan by Friends Salt Works & Allied Ind. & Gautam Freight Pvt. Ltd.,Friends Salt Works & Allied Ind. & Gautam Freight,Energy industries (renewable/non-renewable sources),,AMS-I.D.,Under validation,India,14492.0,Asia,,2014-01-20,2024-01-19,
1638,121,Saihanba North 45.05 MW Windfarm Project,JPMorgan Ventures Energy Corporation,Energy industries (renewable/non-renewable sources),,ACM0002,Registered,China,111812.0,Asia,2009-08-04,2020-11-01,2027-10-31,
1639,139,6 MW RPPL biomass based power plant,Rithwik Power Projects Limited,Energy industries (renewable/non-renewable sources),,AMS-I.D.,Registered,India,24260.0,,2020-04-06,,,
1640,140,Xinjiang Xiaocaohu Wind Power Project,MGM Worldwide LLC,Energy industries (renewable/non-renewable sources),,ACM0002,Registered,China,108924.0,Asia,2020-04-06,2022-03-15,2029-03-14,
1641,123,Longwangtan 15MW Hydro Power Project in Guizhou Province,Longyuan Hydro Power Development in Congiang Count,Energy industries (renewable/non-renewable sources),,AMS-I.D.,Registered,China,43274.0,Asia,2009-08-06,,,
1642,124,Gansu Yumen Sanshilijingzi Wind Power Project,"Gansu Jieyuan Wind Power Co., Ltd.",Energy industries (renewable/non-renewable sources),,ACM0002,Registered,China,106556.0,,2020-06-04,,,
1643,125,Taicang Waste Incineration Project,Taicang Waste Incineration Cogeneration Co. Ltd,Waste handling and disposal,,AM0025,Registered,China,90779.0,,2020-04-06,,,
1644,127,"Fuel switchover from higher carbon intensive fuels to Natural Gas (NG) at Indian Farmers Fertiliser Cooperative Ltd (IFFCO) in Phulpur Village, Allahabad, Uttar Pradesh by M/s Indian Farmers Fertiliser Cooperative Ltd (IFFCO)",INDIAN FARMERS FERTILISER COOPERATIVE LIMITED,Chemical industry; Energy industries (renewable/non-renewable sources),,ACM0009,Registered,India,80000.0,Asia,2009-08-18,,,
1645,128,Promotion of Low cost Irrigation Device in Eastern States of India,International Development Enterprises (India),Energy demand; Energy industries (renewable/non-renewable sources),,AMS-I.B.,Registered,India,25339.0,Asia,2020-04-06,2019-01-01,2025-12-31,
1646,130,"Arrozal, GGP and Sul America Ceramics Fuel Switching Project",Multiple Proponents,Energy industries (renewable/non-renewable sources),,AMS-I.C.,Registered,Brazil,27771.0,Latin America,2020-04-06,2016-04-01,2026-03-31,
1647,134,"3.9 MW Bundled renewable energy project in Tamil Nadu, India",CRP India Private Ltd,Energy industries (renewable/non-renewable sources),,AMS-I.D.,Registered,India,6787.0,Asia,2009-09-03,,,
1648,135,Shangyi Manjing Windfarm Project,Guohua (Hebei) Renewable Energy Co Ltd.,Energy industries (renewable/non-renewable sources),,ACM0002,Registered,China,66207.0,Asia,2020-04-06,,,
1649,136,Tungabhadra Wind Power Project.,Enercon (India) Limited,Energy industries (renewable/non-renewable sources),,ACM0002,Registered,India,49331.0,Asia,2009-09-09,,,
1650,137,Qixia Tangshanpeng Windfarm Project,Carbon Resource Management Ltd,Energy industries (renewable/non-renewable sources),,ACM0002,Registered,China,45774.0,Asia,2009-09-10,2019-01-01,2025-12-31,
1651,99,Saihanba East 45.05 MW Windfarm Project,"Datang Chifeng Saihanba Wind Power Generation Co.,",Energy industries (renewable/non-renewable sources),,ACM0002,Registered,China,111812.0,Asia,2009-07-15,2020-10-01,2027-09-30,
1652,100,Boiler fuel conversion from Furnace Oil to Bagasse at Biltube Core Boards Ltd,JPMorgan Ventures Energy Corporation,Energy industries (renewable/non-renewable sources),,AMS-III.B.,Registered,India,4453.0,Asia,2009-07-15,,,
1653,101,Bagasse based Co-generation Power Project at Khatauli,Triveni Engineering and Industries Limited (TEIL),Energy industries (renewable/non-renewable sources),,ACM0006,Registered,India,86808.0,Asia,2009-07-15,,,
1654,102,6 MW Rice Husk based cogeneration plant at Bhageshwari Papers Private Limited,Bhageshwari Paper Pvt Ltd,Energy industries (renewable/non-renewable sources),,AMS-I.C.,Registered,India,28983.0,Asia,2009-07-15,2020-03-28,2027-03-27,
1655,103,RIMA Fuel Switch in Bocaiúva,RIMA Industrial S/A,Energy industries (renewable/non-renewable sources),,AMS-I.C.,Registered,Brazil,28849.0,Latin America,2009-07-15,,,
1656,104,Wood waste-to-energy project at Sawmill-25 (Arkhangelsk),JSC Sawmill 25,Energy industries (renewable/non-renewable sources),,ACM0006,Registered,Russian Federation,42198.0,,2009-07-15,2006-01-01,2030-12-31,
1657,105,Maoshaping Hydro Power Project,"Yangbi Heihuijiang Electric Power Development Co.,",Energy industries (renewable/non-renewable sources),,AMS-I.D.,Registered,China,31810.0,Asia,2009-07-15,2021-05-10,2028-05-09,
1658,107,Amatitlan Geothermal Project,Ortitlan Limitada,Energy industries (renewable/non-renewable sources),,ACM0002,Registered,Guatemala,82978.0,Latin America,2020-04-06,2021-02-10,2028-02-09,
1659,108,Tiefa Coal Mine Methane Utilisation for Power Generation Project,"Tiefa Coal Industry (Group) Co., Ltd.","Fugitive emissions from fuels (solid, oil and gas); Mining/mineral production",,ACM0008,Registered,China,231759.0,Asia,2020-04-06,2017-10-30,2027-10-29,
1660,110,Mani 14 MW Small Hydropower Project,JPMorgan Ventures Energy Corporation,Energy industries (renewable/non-renewable sources),,AMS-I.D.,Registered,China,56597.0,Asia,2009-07-23,2020-01-09,2027-01-08,
1661,112,"Yunnan Nameguo, Faguo Hydropower stations",Siento Energy Investment,Energy industries (renewable/non-renewable sources),,ACM0002,Registered,China,58077.0,Asia,2020-04-06,2016-04-01,2026-03-31,
1662,114,"7.2 MW Wind Project at Chitradurga, Karnataka",M/s Mysore Mercantile Co. Limited,Energy industries (renewable/non-renewable sources),,AMS-I.D.,Registered,India,13104.0,Asia,2009-07-27,,,
1663,115,Reduction of methane emissions in the low pressure gas distribution network of the Tomsk Oblast in the Russian Federation,Core Carbon Group ApS,"Fugitive emissions from fuels (solid, oil and gas)",,AM0023,Registered,Russian Federation,50734.0,Asia,2009-07-28,,,
1664,116,Jilin Liaoyuan Meihe Coal Mine Methane Power Generation Project,"Liaoyuan Jingang Cement (Holding) Co., Ltd.",Mining/mineral production,,ACM0008,Registered,China,41348.0,Asia,2009-07-29,,,
1665,117,"Waste heat recovery based power plant at Hindustan Zinc Limited, Chanderia",Hindustan Zinc Limited,Energy industries (renewable/non-renewable sources),,ACM0012,Registered,India,51609.0,Asia,2020-04-06,,,
1666,118,Huangyutang Hydro Power Project in Guizhou Province,Guizhou Tengyuan Electric Power Development Co. Lt,Energy industries (renewable/non-renewable sources),,AMS-I.D.,Registered,China,43149.0,Asia,2020-04-06,2022-06-01,2029-05-31,
1667,119,Changtan Hydro Power Project in Guizhou Province,Sinan Tengyuan Shuanghe Electric Power Co. Ltd.,Energy industries (renewable/non-renewable sources),,AMS-I.D.,Registered,China,16447.0,Asia,2020-04-06,2022-06-01,2029-05-31,
1668,148,Hebei Kangbao Wolongtushan 30 MW Wind Farm Project,"Hebei Construction Investment Zhangjiakou Wind Energy Co, Ltd.",Energy industries (renewable/non-renewable sources),,ACM0002,Registered,China,59089.0,Asia,2020-04-06,2021-04-15,2028-04-14,
1669,150,Inner Mongolia Wudaogou 50.25MW Wind Power Project,"Chifeng Xinsheng Wind Power Co., Ltd.",Energy industries (renewable/non-renewable sources),,ACM0002,Registered,China,142848.0,Asia,2020-04-06,,,
1670,151,Yuyao Electricity Generation Project using Natural Gas,Zhejiang Guohua Yuyao Fuel Gas Power Generation Co,Energy industries (renewable/non-renewable sources),,ACM0002; AM0029,Registered,China,804794.0,,2020-04-06,,,
1671,153,"Rick husk based cogeneration plant (5 MW) at Shibzada Ajit Singh Nagar District, Punjab by M/s Nahar Industrial Enterprises limited.",Nahar Industrial Enterprises Limited,Energy industries (renewable/non-renewable sources),,AMS-I.C.,Registered,India,44820.0,Asia,2009-07-31,,,
1672,321,"6.2 MW Bundled Wind Project in Tamil Nadu, Rajasthan and Maharashtra by Interocean.",Interocean Shipping (India) Pvt. Ltd.,Energy industries (renewable/non-renewable sources),,AMS-I.D.,Registered,India,9906.0,Asia,2020-04-06,,,
1673,322,Lara Ceramic fuel switching project,Multiple Proponents,Energy industries (renewable/non-renewable sources),,AMS-I.C.,Registered,Brazil,10275.0,Latin America,2020-04-07,2016-04-01,2026-03-31,
1674,323,Panorama Ceramic Fuel Switching Project,Indústria Cerâmica Panorama LTDA.,Energy industries (renewable/non-renewable sources),,AMS-I.E.,Registered,Brazil,7398.0,Latin America,2020-04-06,,,
1675,325,Lugouhe Hydropower Station Project,"Sichuan Ebian Lugouhe Hydroelectricity Co., Ltd.",Energy industries (renewable/non-renewable sources),,AMS-I.D.,Registered,China,18928.0,Asia,2020-04-06,2019-10-26,2026-10-25,
1676,326,Jinti Hydropower Station Project,"Sichuan Ebian Jindong Tiji Hydropower Co., Ltd.",Energy industries (renewable/non-renewable sources),,AMS-I.D.,Registered,China,17326.0,Asia,2020-04-06,2018-12-25,2025-12-24,
1677,327,Guosheng Hydropower Station Project,"Yanbian Mingyuan Electric Power Co., Ltd",Energy industries (renewable/non-renewable sources),,AMS-I.D.,Registered,China,15121.0,Asia,2020-04-06,2015-08-03,2025-08-02,
1678,328,Huangjueshu Hydropower Station Project,"Panzhihua Reshuihe Power Development Co., Ltd.",Energy industries (renewable/non-renewable sources),,AMS-I.D.,Registered,China,24357.0,Asia,2020-04-06,2015-12-29,2025-12-28,
1679,329,"Nova Dutra, São Silvestre and Vila Nova Fuel Switching Project",Social Carbon Company,Energy industries (renewable/non-renewable sources),,AMS-I.C.,Registered,Brazil,19599.0,Latin America,2020-04-07,2016-04-01,2026-03-31,
1680,330,"Wutuhe Erji hydro power project in Guizhou Province, China","Wutuhe Hydro Power Development Co.,Ltd of Liupansh",Energy industries (renewable/non-renewable sources),,AMS-I.D.,Registered,China,24445.0,Asia,2020-04-06,2016-03-28,2026-03-27,
1681,331,Green Energy to Grid at Dhule Maharashtra,MSPL Limited,Energy industries (renewable/non-renewable sources),,ACM0002,Registered,India,36804.0,Asia,2010-02-24,,,
1682,145,Enercon Bundled Wind power projects (2004 Policy) in Rajasthan,Enercon (India) Limited,Energy industries (renewable/non-renewable sources),,ACM0002,Registered,India,41766.0,Asia,2009-10-03,,,
1683,333,Yunnan Dujiacun Small  Hydropower Project,"Luquan Yulong Power Generation Co., Ltd.",Energy industries (renewable/non-renewable sources),,AMS-I.D.,Registered,China,35000.0,Asia,2010-03-03,,,
1684,334,"Methane Recovery Project Cleanergy Wanroij, North Brabant, The Netherlands,",Cleanergy BV,Energy industries (renewable/non-renewable sources); Waste handling and disposal,,AMS-I.C.; AMS-III.D.,Registered,Netherlands,9643.0,Europe,2020-06-04,,,
1685,336,"Methane Recovery Project Houbensteyn Ysselsteyn, Limburg, The Netherlands",Houbensteyn milieu BV,Energy industries (renewable/non-renewable sources); Waste handling and disposal,,AMS-I.C.; AMS-III.D.,Registered,Netherlands,10666.0,Europe,2020-04-06,,,
1686,340,"Upgradation, Operation and Maintenance of 200 TPD Composting facility at Okhla, Delhi",IL&FS Waste Management & Urban Services Limited,Waste handling and disposal,,AMS-III.F.,Registered,India,8525.0,Asia,2020-04-06,2016-06-15,2023-06-14,
1687,341,União and Dois Companheiros fuel switching project,Multiple Proponents,Energy industries (renewable/non-renewable sources),,AMS-I.E.,Registered,Brazil,30042.0,Latin America,2011-09-07,,,
1688,343,"7.03 MW Bundled grid connected wind electricity generation project in Tamil Nadu and Karnataka, India",PKPN Spinning Mills Pvt Ltd,Energy industries (renewable/non-renewable sources),,AMS-I.D.,Registered,India,15519.0,Asia,2010-02-20,,,
1689,346,Wind power project by GFL in Gudhepanchgani,Gujarat Fluorochemicals Limited (GFL),Energy industries (renewable/non-renewable sources),,ACM0002,Registered,India,51618.0,,2020-04-06,,,
1690,37,ISLWASTE HEAT RECOVERY PROJECT,Ind Synergy Ltd,Energy industries (renewable/non-renewable sources),,ACM0012,Registered,India,67185.0,Asia,2009-04-21,,,
1691,38,Energy Efficiency Project in the Ramla Cement Plant in Israel,Nesher Cement Enterprises Ltd.,Energy industries (renewable/non-renewable sources),,ACM0002; AMS-I.D.; AMS-II.D.,Registered,Israel,8165.0,Middle East,2020-04-06,,,
1692,39,"Offis Textile Ltd. Fuel Switch, Israel",Offis Textile Ltd.,Energy industries (renewable/non-renewable sources),,AMS-I.C.; AMS-III.B.,Registered,Israel,9243.0,Middle East,2020-04-06,,,
1693,40,Yichun Erduoyan Wind Power Project,"Yichun Xinganling Wind Power Co., Ltd.",Energy industries (renewable/non-renewable sources),,ACM0002,Registered,China,61966.0,Asia,2009-05-04,2021-03-29,2028-03-28,
1694,41,Chao Khun Agro Biogas Energy Project,Thai Biogas Energy Company Ltd,Waste handling and disposal,,AMS-III.D.,Registered,Thailand,48167.0,Asia,2020-04-06,,,
1695,42,Ratchaburi Farms Biogas Project at Nong Bua Farm,"Nong Bua Farm & Country Home Village Co., Ltd.",Energy industries (renewable/non-renewable sources),,AMS-III.D.,Registered,Thailand,15958.0,Asia,2020-04-06,,,
1696,44,Jiratpattana Biogas Energy Project,Thai Biogas Energy Company Ltd,Energy industries (renewable/non-renewable sources),,AMS-I.D.,Registered,Thailand,24726.0,Asia,2020-04-06,,,
1697,45,Zhoubai Hydroelectric Project,Chongqing Wujiang Industry (power) Group,Energy industries (renewable/non-renewable sources),,ACM0002,Registered,China,58051.0,Asia,2020-04-06,,,
1698,47,Jinan Landfill Gas to Energy Project,"Shandong Shifang New Energy Co., Ltd.",Energy industries (renewable/non-renewable sources),,ACM0001; AMS-I.D.,Registered,China,112908.0,Asia,2020-04-06,2020-05-01,2027-04-30,
1699,48,Shandong Tuoji Island Wind Farm Project,Carbon Resource Management Ltd,Energy industries (renewable/non-renewable sources),,AMS-I.D.,Registered,China,24998.0,Asia,2009-05-05,2021-03-03,2028-03-02,
1700,50,Willow Creek Dairy Farm Project,Willow Creek,Waste handling and disposal,,AMS-III.Y; VMR0003,Registered,United States,16018.0,North America,2009-05-12,2016-03-26,2026-03-25,
1701,51,29.70 MW Wind Power project in Karnataka India,ACCIONA WIND ENERGY PVT. LTD.,Energy industries (renewable/non-renewable sources),,ACM0002,Registered,India,88240.0,Asia,2020-04-06,,,
1702,55,Lucevans Ceramic Fuel Switching Project,Cerâmica Lucevans Ltda. – ME.,Energy industries (renewable/non-renewable sources),,AMS-I.E.,Registered,Brazil,9144.0,Latin America,2020-04-06,,,
1703,56,"Manasi River Stage I Hydropower Project of Hongshanzui Hydropower Plant, Xinjiang Tianfu Thermoelectric Co., Ltd.","Xinjiang Tianfu Thermoelectric Co., Ltd.",Energy industries (renewable/non-renewable sources),,ACM0002,Registered,China,150000.0,Asia,2020-04-06,2021-01-01,2027-12-31,
1704,57,Waste Biomass Utilization at JSC Arkhangelsk Pulp and Paper Mill (APPM),Arkhangelsk Pulp and Paper Mill,Waste handling and disposal,,ACM0006,Registered,Russian Federation,204290.0,,2020-04-06,,,
1705,58,Pubu Hydropower Station Project,Panzhihua Reshuihe Electric Power Development Co.,Energy industries (renewable/non-renewable sources),,ACM0002; AMS-I.D.,Registered,China,8746.0,Asia,2020-04-06,2022-01-01,2028-12-31,
1706,59,Biomass powered process heat production and use project at Kangwal,"Kangwal Polyester Co.,Ltd",Energy industries (renewable/non-renewable sources),,AMS-I.C.,Registered,Thailand,21885.0,Asia,2020-04-06,,,
1707,60,Irmãos Fredi Ceramic Fuel Switching Project,Multiple Proponents,Energy industries (renewable/non-renewable sources),,AMS-I.E.,Registered,Brazil,21743.0,Latin America,2011-07-01,2020-04-01,2027-03-31,
1708,61,Tapajós Ceramic Fuel Switching Project,Multiple Proponents,Energy industries (renewable/non-renewable sources),,AMS-I.E.,Registered,Brazil,10622.0,Latin America,2020-04-07,2016-04-01,2026-03-31,
1709,62,Yunnan Dehong Longchuan Bienaihe 1st and 2nd Level Hydropower Stations,"Longchuan Minhong Hydro Power Co., Ltd.",Energy industries (renewable/non-renewable sources),,ACM0002; AMS-I.D.,Registered,China,34907.0,Asia,2020-04-06,2020-03-28,2027-03-27,
1710,65,Reunidas Ceramic Switching Non-Renewable Biomass Project,Multiple Proponents,Energy industries (renewable/non-renewable sources),,AMS-I.E.,Registered,Brazil,9654.0,Latin America,2020-04-06,2017-10-01,2027-09-30,
1711,67,Ratchaburi Farms Biogas Project at SPM Farm,"SPM Feedmill Co., Ltd.",Energy industries (renewable/non-renewable sources),,AMS-I.D.; AMS-III.D.,Registered,Thailand,23556.0,Asia,2020-04-06,,,
1712,68,"119.8 MW Natural Gas based Combined Cycle Power Plant, at Tanjavur, Tamilnadu by M/s Aban  Power Company Limited",Lanco Tanjore Power Company Limited,Energy industries (renewable/non-renewable sources),,AM0029,Registered,India,181153.0,Asia,2020-04-06,,,
1713,70,Irani Wastewater Methane Avoidance Project,EcoSecurities International Limited,Waste handling and disposal,,AMS-III.I.,Registered,Brazil,55966.0,Latin America,2020-04-06,2021-04-01,2028-03-31,
1714,71,Chengde Hongsong Windfarm Project,Hebei Hong-Song Wind Power Share Holding Ltd.,Energy industries (renewable/non-renewable sources),,ACM0002,Registered,China,110000.0,Asia,2009-06-11,,,
1715,73,"Mingying 3.75MW Hydro Power Project in Guizhou Province, China",Guizhou Qiannan Zhongshui Hydro Power Development,Energy industries (renewable/non-renewable sources),,AMS-I.D.,Registered,China,8268.0,Asia,2009-06-15,2020-12-18,2027-12-17,
1716,75,5.4 MW Grouped Wind Power Project in Gujarat & Maharashtra (India) by Rohan Builders (India) Pvt Ltd.,Rohan Builders (India),Energy industries (renewable/non-renewable sources),,AMS-I.D.,Registered,India,9143.0,Asia,2009-06-15,,,
1717,76,Liaoyuan Jingang cement Waste Heat Recovery,"Liaoyuan Jingang Cement (Holding) Co., Ltd.",Energy industries (renewable/non-renewable sources),,ACM0012,Registered,China,100636.0,Asia,2009-06-15,2020-09-29,2027-09-28,
1718,78,NOBRECEL Biomass energy project,EcoSecurities International Limited,Energy industries (renewable/non-renewable sources),,ACM0006,Registered,Brazil,76743.0,Latin America,2020-04-06,2022-01-01,2031-12-31,
1719,79,New Zealand Household Energy Efficient Lighting Projects (HELP),Energy Mad Limited,Energy demand,,AM0046,Registered,New Zealand,107800.0,Oceania,2020-04-06,,,
1720,80,Greenville County Landfill Gas Utilization Project,"Greenville Gas Producers, LLC",Waste handling and disposal,,ACM0001,Registered,United States,145008.0,North America,2009-06-19,2017-08-01,2027-07-31,
1721,81,São Judas Tadeu Fuel Switching Project,Ceramic Sao Judas Tadeu Ltda,Energy industries (renewable/non-renewable sources),,AMS-I.E.,Registered,Brazil,16416.0,Latin America,2020-04-06,2021-12-01,2028-11-30,
1722,53,Milenium Ceramic Switching Non Renewable Biomass Project,Ceramica Milenium,Energy industries (renewable/non-renewable sources),,AMS-I.E.,Registered,Brazil,23371.0,Latin America,2020-04-06,2017-09-01,2027-08-31,
1723,85,Shizibao Hydropower Station Project,"Yanbian Heli Electric Power Co., Ltd.",Energy industries (renewable/non-renewable sources),,ACM0002; AMS-I.D.,Registered,China,7626.0,Asia,2020-04-06,2021-06-01,2028-05-31,
1724,87,Xiangshuihe Hydropower Station Project,"Yanbian Heli Electric Power Co., Ltd.",Energy industries (renewable/non-renewable sources),,AMS-I.D.,Registered,China,5922.0,Asia,2020-04-06,2021-06-01,2028-05-31,
1725,88,Sanchawan 32MW Hydro Power Project,"Guizhou Anshun Sanchawan Hydropower Co., Ltd.",Energy industries (renewable/non-renewable sources),,ACM0002,Registered,China,117618.0,Asia,2009-06-30,2020-11-01,2027-10-31,
1726,90,Dongliuxi Erji 12.6 MW Hydropower Project in Hubei Province,Essent Trading,Energy industries (renewable/non-renewable sources),,AMS-I.D.,Registered,China,44982.0,Asia,2020-04-06,2021-07-15,2028-07-14,
1727,91,Changshatou 10MW Hydropower Project in Hubei Province,"Yichang Changfeng Hydropower Development Co., Ltd",Energy industries (renewable/non-renewable sources),,AMS-I.D.,Registered,China,33022.0,Asia,2020-04-06,2017-12-10,2027-12-09,
1728,94,Jiangsu  Qingshi Cement  Plant’s Low Temperature Waste Heat Power  Generation Project,Jiangsu Qingshi Cement Co. Ltd.,Energy distribution,,ACM0012,Registered,China,81491.0,Asia,2009-07-15,2021-12-01,2028-11-30,
1729,95,Heilongjiang Huafu Muling Wind Farm Project,Heilongjiang Huafu Muling Wind Power Co. Ltd,Energy industries (renewable/non-renewable sources),,ACM0002,Registered,China,76644.0,Asia,2009-07-15,2019-12-14,2026-12-13,
1730,96,Shandong Yucheng Xinyuan Biomass Heat & Power,"Shandong Yuchen Xinyuan Heat & Power Co., Ltd.",Energy industries (renewable/non-renewable sources),,ACM0002; ACM0006,Registered,China,189552.0,Asia,2009-07-15,2021-01-01,2027-12-31,
1731,97,Yanling Shendu Hydropower Project,"Hunan Zhongda Shendu Hydropower Co., Ltd.",Energy industries (renewable/non-renewable sources),,AMS-I.D.,Registered,China,19883.0,Asia,2009-07-15,2020-02-13,2027-02-12,
1732,159,"Minister Stein 4, Utilization of Coalmine Methane",Carbon-TF B.V.,Mining/mineral production,,AMS-III.D.,Registered,Germany,94132.0,,2020-04-06,,,
1733,1176,System of Root Intensification (SRI) programme: Reduction of Methane emissions and water consumption in rice fields of India,Emergent Ventures India Private Limited,Agriculture Forestry and Other Land Use,ALM,AMS-III.AU,Registration requested,India,56776.0,,,2014-06-01,2024-05-31,
1734,362,"Grid-connected wind electricity generation project identified as Project E6 in Maharashtra, India",KANDHARI BEVERAGES PRIVATE LIMITED,Energy industries (renewable/non-renewable sources),,AMS-I.D.,Registered,India,9439.0,Asia,2010-03-22,,,
1735,363,Caldere Hydro Power Plant Project,Caldere Elektrik Uretim A.S.,Energy industries (renewable/non-renewable sources),,AMS-I.D.,Registered,Turkey,21000.0,,2020-04-06,2018-04-04,2028-04-03,
1736,364,Bundled 15 MW Wind Power Project in India,Gangadhar Narsingdas Agrawal (HUF),Energy industries (renewable/non-renewable sources),,AMS-I.D.,Registered,India,33019.0,,2020-04-06,,,
1737,366,Kaona Power Supply Biomass Cogeneration Project,"Kaona Power Supply Co., Ltd",Energy industries (renewable/non-renewable sources),,AMS-I.C.,Registered,Thailand,25694.0,,2020-04-06,,,
1738,367,Kitroongruang Biogas Energy Project,Thai Biogas Energy Company Ltd,Waste handling and disposal,,ACM0014,Registered,Thailand,17328.0,,2020-04-06,,,
1739,374,"Capacity enhancement for export of surplus power to  grid at Lakshmipuram, Andhra Pradesh, India",K.C.P SUGAR AND INDUSTRIES CORPORATION LIMITED,Energy industries (renewable/non-renewable sources),,ACM0006,Registered,India,3648.0,Asia,2010-03-30,,,
1740,376,"Positive Climate Care 8.25 MW Bundled Wind Power Project Activity by Savita Oil Technologies Limited in Hassan, Karnataka, India.",Savita Oil Technologies Limited,Energy industries (renewable/non-renewable sources),,AMS-I.D.,Registered,India,17757.0,Asia,2010-05-04,,,
1741,377,"11.60 MW Bundled grid-connected wind electricity generation project at Tirunelveli, Tamil Nadu, India",Indian Wind Power Association,Energy industries (renewable/non-renewable sources),,AMS-I.D.,Registered,India,29586.0,Asia,2020-04-06,,,
1742,379,7.85 MW Bundled Wind Power Project in Southern India,Vandana Ispat Limited,Energy industries (renewable/non-renewable sources),,AMS-I.D.,Registered,India,15694.0,,2020-04-06,,,
